platform,query,rank,url,title,snippet,publisher,views,likes,comments,published_at,raw_text,scan_text,brand_mentions_json,dominant_brand,sentiment,sentiment_label,engagement,wsov_item
youtube,smart fan,28,https://www.youtube.com/watch?v=X_DAR5U5NdA,Airbrick Register Booster Fan ceiling installation. Smart Fan with Remote. Fits 4” x 10” Registers.,"Thinking about installing the Airbrick register booster fan on the ceiling? In general, we don't recommend it due to varying ceiling ...",AIRBRICK,20498.0,82.0,0.0,2024-06-25 11:00:27,"Airbrick Register Booster Fan ceiling installation. Smart Fan with Remote. Fits 4” x 10” Registers. Thinking about installing the Airbrick register booster fan on the ceiling? In general, we don't recommend it due to varying ceiling ...","Airbrick Register Booster Fan ceiling installation. Smart Fan with Remote. Fits 4” x 10” Registers. Thinking about installing the Airbrick register booster fan on the ceiling? In general, we don't recommend it due to varying ceiling ... Airbrick Register Booster Fan ceiling installation. Smart Fan with Remote. Fits 4” x 10” Registers. Thinking about installing the Airbrick register booster fan on the ceiling? In general, we don't recommend it due to varying ceiling ...","{""Atomberg"": 0, ""Atomberg Renesa"": 0, ""Atomberg Efficio"": 0, ""Atomberg Studio"": 0, ""Orient"": 0, ""Havells"": 0, ""Usha"": 0, ""Crompton"": 0, ""Luminous"": 0, ""Bajaj"": 0, ""Polycab"": 0, ""V-Guard"": 0, ""Anchor"": 0, ""Panasonic"": 0}",,-0.9866081476211548,negative,7.282531012408311,0.04876329013126715
youtube,smart fan,29,https://www.youtube.com/watch?v=hdDels9Z5ww,Atomberg Renesa 1200mm BLDC Motor 5 Star | Ceiling fan Installation #electricalelectricianwireman,bldcfan #smartfan #electricalelectricianwireman #google Atomberg Renesa 1200mm BLDC Motor 5 Star | Atomberg Ceiling fan ...,Electrical Electrician Wireman,1647468.0,26107.0,240.0,2023-07-29 04:30:25,Atomberg Renesa 1200mm BLDC Motor 5 Star | Ceiling fan Installation #electricalelectricianwireman bldcfan #smartfan #electricalelectricianwireman #google Atomberg Renesa 1200mm BLDC Motor 5 Star | Atomberg Ceiling fan ...,Atomberg Renesa 1200mm BLDC Motor 5 Star | Ceiling fan Installation #electricalelectricianwireman bldcfan #smartfan #electricalelectricianwireman #google Atomberg Renesa 1200mm BLDC Motor 5 Star | Atomberg Ceiling fan ... Atomberg Renesa 1200mm BLDC Motor 5 Star | Ceiling fan Installation #electricalelectricianwireman bldcfan #smartfan #electricalelectricianwireman #google Atomberg Renesa 1200mm BLDC Motor 5 Star | Atomberg Ceiling fan ...,"{""Atomberg"": 6, ""Atomberg Renesa"": 4, ""Atomberg Efficio"": 0, ""Atomberg Studio"": 0, ""Orient"": 0, ""Havells"": 0, ""Usha"": 0, ""Crompton"": 0, ""Luminous"": 0, ""Bajaj"": 0, ""Polycab"": 0, ""V-Guard"": 0, ""Anchor"": 0, ""Panasonic"": 0}",Atomberg,-0.9869476556777954,negative,12.188329248551577,0.07954313503224615
youtube,smart fan,30,https://www.youtube.com/watch?v=fy4dJlZMlac,BLDC CEILING FAN #havells 1200MM,, ELECTRIC WORK,557005.0,2158.0,39.0,2025-03-06 17:25:07,BLDC CEILING FAN #havells 1200MM ,BLDC CEILING FAN #havells 1200MM  BLDC CEILING FAN #havells 1200MM ,"{""Atomberg"": 0, ""Atomberg Renesa"": 0, ""Atomberg Efficio"": 0, ""Atomberg Studio"": 0, ""Orient"": 0, ""Havells"": 2, ""Usha"": 0, ""Crompton"": 0, ""Luminous"": 0, ""Bajaj"": 0, ""Polycab"": 0, ""V-Guard"": 0, ""Anchor"": 0, ""Panasonic"": 0}",Havells,-0.970024824142456,negative,10.61030684907237,0.15902290685172363
youtube,smart fan,31,https://www.youtube.com/watch?v=YG75g6duhNQ,2024 New Bladeless Fan Light2024 new bladeless fan light #interiordesign #lampfactory,, aleadhomelightings,261356.0,1938.0,28.0,2024-04-23 02:09:43,2024 New Bladeless Fan Light2024 new bladeless fan light #interiordesign #lampfactory ,2024 New Bladeless Fan Light2024 new bladeless fan light #interiordesign #lampfactory  2024 New Bladeless Fan Light2024 new bladeless fan light #interiordesign #lampfactory ,"{""Atomberg"": 0, ""Atomberg Renesa"": 0, ""Atomberg Efficio"": 0, ""Atomberg Studio"": 0, ""Orient"": 0, ""Havells"": 0, ""Usha"": 0, ""Crompton"": 0, ""Luminous"": 0, ""Bajaj"": 0, ""Polycab"": 0, ""V-Guard"": 0, ""Anchor"": 0, ""Panasonic"": 0}",,-0.9952813982963562,negative,10.091893420244544,0.023809812742878775
youtube,smart fan,32,https://www.youtube.com/watch?v=Cig43n-kSBA,Review - Xiaomi Smart Tower Fan,"I mean, it's a stand fan - but comes packed with a lot of different features too. Visit http://nasilemaktech.com/ for more news and ...",NL Tech,188330.0,1936.0,20.0,2023-01-17 04:00:06,"Review - Xiaomi Smart Tower Fan I mean, it's a stand fan - but comes packed with a lot of different features too. Visit http://nasilemaktech.com/ for more news and ...","Review - Xiaomi Smart Tower Fan I mean, it's a stand fan - but comes packed with a lot of different features too. Visit http://nasilemaktech.com/ for more news and ... Review - Xiaomi Smart Tower Fan I mean, it's a stand fan - but comes packed with a lot of different features too. Visit http://nasilemaktech.com/ for more news and ...","{""Atomberg"": 0, ""Atomberg Renesa"": 0, ""Atomberg Efficio"": 0, ""Atomberg Studio"": 0, ""Orient"": 0, ""Havells"": 0, ""Usha"": 0, ""Crompton"": 0, ""Luminous"": 0, ""Bajaj"": 0, ""Polycab"": 0, ""V-Guard"": 0, ""Anchor"": 0, ""Panasonic"": 0}",,0.9881558418273926,positive,9.862694741996354,9.804287083730179
youtube,smart fan,33,https://www.youtube.com/watch?v=VOrnBVxSDvQ,Smart Ceiling Fan 🤔 #fansound #fan #shortvideo #shorts #viralvideo,Smart Ceiling Fan #fansound #fan #shortvideo #shorts #viralvideo.,Triangle Gamer,2843614.0,9918.0,18.0,2024-11-07 05:04:06,Smart Ceiling Fan 🤔 #fansound #fan #shortvideo #shorts #viralvideo Smart Ceiling Fan #fansound #fan #shortvideo #shorts #viralvideo.,Smart Ceiling Fan 🤔 #fansound #fan #shortvideo #shorts #viralvideo Smart Ceiling Fan #fansound #fan #shortvideo #shorts #viralvideo. Smart Ceiling Fan 🤔 #fansound #fan #shortvideo #shorts #viralvideo Smart Ceiling Fan #fansound #fan #shortvideo #shorts #viralvideo.,"{""Atomberg"": 0, ""Atomberg Renesa"": 0, ""Atomberg Efficio"": 0, ""Atomberg Studio"": 0, ""Orient"": 0, ""Havells"": 0, ""Usha"": 0, ""Crompton"": 0, ""Luminous"": 0, ""Bajaj"": 0, ""Polycab"": 0, ""V-Guard"": 0, ""Anchor"": 0, ""Panasonic"": 0}",,-0.6947548985481262,negative,11.971458127356684,1.827114475305925
youtube,smart fan,34,https://www.youtube.com/watch?v=VQpdtszVEBk,Dreo smart fan,,Teofilmvisuals,16646.0,149.0,2.0,2024-07-11 13:51:53,Dreo smart fan ,Dreo smart fan  Dreo smart fan ,"{""Atomberg"": 0, ""Atomberg Renesa"": 0, ""Atomberg Efficio"": 0, ""Atomberg Studio"": 0, ""Orient"": 0, ""Havells"": 0, ""Usha"": 0, ""Crompton"": 0, ""Luminous"": 0, ""Bajaj"": 0, ""Polycab"": 0, ""V-Guard"": 0, ""Anchor"": 0, ""Panasonic"": 0}",,0.9995808005332947,positive,7.445042996492094,7.44348251746523
youtube,smart fan,35,https://www.youtube.com/watch?v=Kk9jXCx4-Gw,Dreo Smart Pedestal Fan DR HAF003S: Features and Review #shorts,Discover the exceptional features and functionality of the Dreo Smart Pedestal Fan with Remote (Model DR HAF003S) in this ...,Vacuum Chef,92241.0,685.0,20.0,2023-10-16 22:22:58,Dreo Smart Pedestal Fan DR HAF003S: Features and Review #shorts Discover the exceptional features and functionality of the Dreo Smart Pedestal Fan with Remote (Model DR HAF003S) in this ...,Dreo Smart Pedestal Fan DR HAF003S: Features and Review #shorts Discover the exceptional features and functionality of the Dreo Smart Pedestal Fan with Remote (Model DR HAF003S) in this ... Dreo Smart Pedestal Fan DR HAF003S: Features and Review #shorts Discover the exceptional features and functionality of the Dreo Smart Pedestal Fan with Remote (Model DR HAF003S) in this ...,"{""Atomberg"": 0, ""Atomberg Renesa"": 0, ""Atomberg Efficio"": 0, ""Atomberg Studio"": 0, ""Orient"": 0, ""Havells"": 0, ""Usha"": 0, ""Crompton"": 0, ""Luminous"": 0, ""Bajaj"": 0, ""Polycab"": 0, ""V-Guard"": 0, ""Anchor"": 0, ""Panasonic"": 0}",,0.9951371550559998,positive,9.123018034455164,9.100836123393728
youtube,smart fan,36,https://www.youtube.com/watch?v=LI-6Lap5Nv8,"The newly developed bladeless ceiling fan light can be switched when the light is turned on,","The newly developed bladeless ceiling fan light can be switched when the light is turned on, can rotate and turn, and has strong ...",VhopeL light,141306.0,1170.0,38.0,2024-05-18 04:05:02,"The newly developed bladeless ceiling fan light can be switched when the light is turned on, The newly developed bladeless ceiling fan light can be switched when the light is turned on, can rotate and turn, and has strong ...","The newly developed bladeless ceiling fan light can be switched when the light is turned on, The newly developed bladeless ceiling fan light can be switched when the light is turned on, can rotate and turn, and has strong ... The newly developed bladeless ceiling fan light can be switched when the light is turned on, The newly developed bladeless ceiling fan light can be switched when the light is turned on, can rotate and turn, and has strong ...","{""Atomberg"": 0, ""Atomberg Renesa"": 0, ""Atomberg Efficio"": 0, ""Atomberg Studio"": 0, ""Orient"": 0, ""Havells"": 0, ""Usha"": 0, ""Crompton"": 0, ""Luminous"": 0, ""Bajaj"": 0, ""Polycab"": 0, ""V-Guard"": 0, ""Anchor"": 0, ""Panasonic"": 0}",,0.9953063130378723,positive,9.60125423815112,9.578721597232278
youtube,smart fan,37,https://www.youtube.com/watch?v=sesi0gqneTM,LED Ceiling Fan Lamp With Remote Control 🪩 #fanlamp #lamp #fanlight #shorts #shortvideo #ledlamps,LED Ceiling Fan Lamp With Remote Control #fanlamp #lamp #fanlight #shorts #shortvideo #ledlamps #ledlights #tracklight ...,TokTak Gadget,668621.0,3009.0,13.0,2025-04-03 12:55:52,LED Ceiling Fan Lamp With Remote Control 🪩 #fanlamp #lamp #fanlight #shorts #shortvideo #ledlamps LED Ceiling Fan Lamp With Remote Control #fanlamp #lamp #fanlight #shorts #shortvideo #ledlamps #ledlights #tracklight ...,LED Ceiling Fan Lamp With Remote Control 🪩 #fanlamp #lamp #fanlight #shorts #shortvideo #ledlamps LED Ceiling Fan Lamp With Remote Control #fanlamp #lamp #fanlight #shorts #shortvideo #ledlamps #ledlights #tracklight ... LED Ceiling Fan Lamp With Remote Control 🪩 #fanlamp #lamp #fanlight #shorts #shortvideo #ledlamps LED Ceiling Fan Lamp With Remote Control #fanlamp #lamp #fanlight #shorts #shortvideo #ledlamps #ledlights #tracklight ...,"{""Atomberg"": 0, ""Atomberg Renesa"": 0, ""Atomberg Efficio"": 0, ""Atomberg Studio"": 0, ""Orient"": 0, ""Havells"": 0, ""Usha"": 0, ""Crompton"": 0, ""Luminous"": 0, ""Bajaj"": 0, ""Polycab"": 0, ""V-Guard"": 0, ""Anchor"": 0, ""Panasonic"": 0}",,-0.9923428893089294,negative,10.714598834486514,0.04102143464303941
youtube,smart fan,38,https://www.youtube.com/watch?v=BWMkRyticDY,“Smart. Minimal. Powerful.”— A fan that listens to you,Not your average ceiling light. This minimalist white ceiling fan light pairs clean design with premium blades that deliver a ...,Parrotuncle,4305.0,28.0,0.0,2025-08-25 05:30:05,“Smart. Minimal. Powerful.”— A fan that listens to you Not your average ceiling light. This minimalist white ceiling fan light pairs clean design with premium blades that deliver a ...,“Smart. Minimal. Powerful.”— A fan that listens to you Not your average ceiling light. This minimalist white ceiling fan light pairs clean design with premium blades that deliver a ... “Smart. Minimal. Powerful.”— A fan that listens to you Not your average ceiling light. This minimalist white ceiling fan light pairs clean design with premium blades that deliver a ...,"{""Atomberg"": 0, ""Atomberg Renesa"": 0, ""Atomberg Efficio"": 0, ""Atomberg Studio"": 0, ""Orient"": 0, ""Havells"": 0, ""Usha"": 0, ""Crompton"": 0, ""Luminous"": 0, ""Bajaj"": 0, ""Polycab"": 0, ""V-Guard"": 0, ""Anchor"": 0, ""Panasonic"": 0}",,0.994426965713501,positive,6.030847555750527,6.014042495648104
youtube,smart fan,39,https://www.youtube.com/watch?v=vbkkxwkJPvs,Dreo Fan Review  #dreo  #fan  #shorts,Must have fan for the summer! Link to the fan: ...,Shantel De Bonsu,98438.0,954.0,52.0,2024-08-16 11:01:05,Dreo Fan Review  #dreo  #fan  #shorts Must have fan for the summer! Link to the fan: ...,Dreo Fan Review  #dreo  #fan  #shorts Must have fan for the summer! Link to the fan: ... Dreo Fan Review  #dreo  #fan  #shorts Must have fan for the summer! Link to the fan: ...,"{""Atomberg"": 0, ""Atomberg Renesa"": 0, ""Atomberg Efficio"": 0, ""Atomberg Studio"": 0, ""Orient"": 0, ""Havells"": 0, ""Usha"": 0, ""Crompton"": 0, ""Luminous"": 0, ""Bajaj"": 0, ""Polycab"": 0, ""V-Guard"": 0, ""Anchor"": 0, ""Panasonic"": 0}",,-0.9499350786209106,negative,9.353858001088168,0.23415008270782253
youtube,smart fan,40,https://www.youtube.com/watch?v=SwRKYEhK8dI,Best BLDC Ceiling Fan In 2025⚡Top 3 BLDC Fan 2025 in India Atomberg Renesa Enzel BLDC Fan,atomberg renesa enzel review atomberg renesa enzel 1200mm atomberg renesa enzel 1200mm review atomberg renesa enzel ...,Gadgets Munch,393490.0,2104.0,93.0,2025-04-10 08:51:16,Best BLDC Ceiling Fan In 2025⚡Top 3 BLDC Fan 2025 in India Atomberg Renesa Enzel BLDC Fan atomberg renesa enzel review atomberg renesa enzel 1200mm atomberg renesa enzel 1200mm review atomberg renesa enzel ...,Best BLDC Ceiling Fan In 2025⚡Top 3 BLDC Fan 2025 in India Atomberg Renesa Enzel BLDC Fan atomberg renesa enzel review atomberg renesa enzel 1200mm atomberg renesa enzel 1200mm review atomberg renesa enzel ... Best BLDC Ceiling Fan In 2025⚡Top 3 BLDC Fan 2025 in India Atomberg Renesa Enzel BLDC Fan atomberg renesa enzel review atomberg renesa enzel 1200mm atomberg renesa enzel 1200mm review atomberg renesa enzel ...,"{""Atomberg"": 10, ""Atomberg Renesa"": 10, ""Atomberg Efficio"": 0, ""Atomberg Studio"": 0, ""Orient"": 0, ""Havells"": 0, ""Usha"": 0, ""Crompton"": 0, ""Luminous"": 0, ""Bajaj"": 0, ""Polycab"": 0, ""V-Guard"": 0, ""Anchor"": 0, ""Panasonic"": 0}",Atomberg,0.9982506632804871,positive,10.479638787010035,10.470472578541361
youtube,smart fan,41,https://www.youtube.com/watch?v=_B_G_H5YpxM,Atomberg bldc fan installation / bldc ceiling fan installation / atomberg ceiling fan fitting #home,Here's a suggested YouTube video title and description for a video on installing an Atomberg BLDC ceiling fan: --- Title: How to ...,Anand Tech solutions,2324316.0,24618.0,139.0,2025-06-05 07:14:17,Atomberg bldc fan installation / bldc ceiling fan installation / atomberg ceiling fan fitting #home Here's a suggested YouTube video title and description for a video on installing an Atomberg BLDC ceiling fan: --- Title: How to ...,Atomberg bldc fan installation / bldc ceiling fan installation / atomberg ceiling fan fitting #home Here's a suggested YouTube video title and description for a video on installing an Atomberg BLDC ceiling fan: --- Title: How to ... Atomberg bldc fan installation / bldc ceiling fan installation / atomberg ceiling fan fitting #home Here's a suggested YouTube video title and description for a video on installing an Atomberg BLDC ceiling fan: --- Title: How to ...,"{""Atomberg"": 6, ""Atomberg Renesa"": 0, ""Atomberg Efficio"": 0, ""Atomberg Studio"": 0, ""Orient"": 0, ""Havells"": 0, ""Usha"": 0, ""Crompton"": 0, ""Luminous"": 0, ""Bajaj"": 0, ""Polycab"": 0, ""V-Guard"": 0, ""Anchor"": 0, ""Panasonic"": 0}",Atomberg,-0.9985719919204712,negative,12.322908450963201,0.008798606415634644
youtube,smart fan,42,https://www.youtube.com/watch?v=-j7uxC8Yg94,Smart Fan #fan #atomberg #wifi #air #shorts #short #homedecor #home #homeappliances #smart #gadgets,,Breakless Unboxing,6335.0,41.0,0.0,2024-10-07 15:15:13,Smart Fan #fan #atomberg #wifi #air #shorts #short #homedecor #home #homeappliances #smart #gadgets ,Smart Fan #fan #atomberg #wifi #air #shorts #short #homedecor #home #homeappliances #smart #gadgets  Smart Fan #fan #atomberg #wifi #air #shorts #short #homedecor #home #homeappliances #smart #gadgets ,"{""Atomberg"": 2, ""Atomberg Renesa"": 0, ""Atomberg Efficio"": 0, ""Atomberg Studio"": 0, ""Orient"": 0, ""Havells"": 0, ""Usha"": 0, ""Crompton"": 0, ""Luminous"": 0, ""Bajaj"": 0, ""Polycab"": 0, ""V-Guard"": 0, ""Anchor"": 0, ""Panasonic"": 0}",Atomberg,0.9706596732139587,positive,6.373702645581567,6.280199386352357
youtube,smart fan,43,https://www.youtube.com/watch?v=RTLhnfY4Y4Y,30watt I Inverter Fan I Ceiling Fan I Remote Control,Low Power Consumption FAN Excellent Performance even on Low Voltage Noiseless Operation Built-In Smart Controller Strong ...,Technology Updates,125045.0,564.0,6.0,2025-05-30 09:30:43,30watt I Inverter Fan I Ceiling Fan I Remote Control Low Power Consumption FAN Excellent Performance even on Low Voltage Noiseless Operation Built-In Smart Controller Strong ...,30watt I Inverter Fan I Ceiling Fan I Remote Control Low Power Consumption FAN Excellent Performance even on Low Voltage Noiseless Operation Built-In Smart Controller Strong ... 30watt I Inverter Fan I Ceiling Fan I Remote Control Low Power Consumption FAN Excellent Performance even on Low Voltage Noiseless Operation Built-In Smart Controller Strong ...,"{""Atomberg"": 0, ""Atomberg Renesa"": 0, ""Atomberg Efficio"": 0, ""Atomberg Studio"": 0, ""Orient"": 0, ""Havells"": 0, ""Usha"": 0, ""Crompton"": 0, ""Luminous"": 0, ""Bajaj"": 0, ""Polycab"": 0, ""V-Guard"": 0, ""Anchor"": 0, ""Panasonic"": 0}",,0.9933359622955322,positive,9.137500903402891,9.107054578130448
youtube,smart fan,44,https://www.youtube.com/watch?v=AV2MTJUCizM,Dreo Smart Fan DR HAF004S: Intelligent Cooling Unveiled #shorts,Discover smart cooling with the Dreo Smart Fan Silver Large DR HAF004S in our latest review. This sleek and efficient fan offers ...,Vacuum Chef,8830.0,118.0,2.0,2023-11-01 00:47:38,Dreo Smart Fan DR HAF004S: Intelligent Cooling Unveiled #shorts Discover smart cooling with the Dreo Smart Fan Silver Large DR HAF004S in our latest review. This sleek and efficient fan offers ...,Dreo Smart Fan DR HAF004S: Intelligent Cooling Unveiled #shorts Discover smart cooling with the Dreo Smart Fan Silver Large DR HAF004S in our latest review. This sleek and efficient fan offers ... Dreo Smart Fan DR HAF004S: Intelligent Cooling Unveiled #shorts Discover smart cooling with the Dreo Smart Fan Silver Large DR HAF004S in our latest review. This sleek and efficient fan offers ...,"{""Atomberg"": 0, ""Atomberg Renesa"": 0, ""Atomberg Efficio"": 0, ""Atomberg Studio"": 0, ""Orient"": 0, ""Havells"": 0, ""Usha"": 0, ""Crompton"": 0, ""Luminous"": 0, ""Bajaj"": 0, ""Polycab"": 0, ""V-Guard"": 0, ""Anchor"": 0, ""Panasonic"": 0}",,0.9985289573669434,positive,6.995212399281551,6.990067271448236
youtube,smart fan,45,https://www.youtube.com/watch?v=QGFYUCxOPAs,Installing my new Smart Fan | Atomberg Renesa Smart +,"Installing my new Smart Fan | Atomberg Renesa Smart + Hey guys! In this video, I'm going to show you how I installed the ...",Tech Features Life,646170.0,8847.0,85.0,2023-04-21 18:24:15,"Installing my new Smart Fan | Atomberg Renesa Smart + Installing my new Smart Fan | Atomberg Renesa Smart + Hey guys! In this video, I'm going to show you how I installed the ...","Installing my new Smart Fan | Atomberg Renesa Smart + Installing my new Smart Fan | Atomberg Renesa Smart + Hey guys! In this video, I'm going to show you how I installed the ... Installing my new Smart Fan | Atomberg Renesa Smart + Installing my new Smart Fan | Atomberg Renesa Smart + Hey guys! In this video, I'm going to show you how I installed the ...","{""Atomberg"": 4, ""Atomberg Renesa"": 4, ""Atomberg Efficio"": 0, ""Atomberg Studio"": 0, ""Orient"": 0, ""Havells"": 0, ""Usha"": 0, ""Crompton"": 0, ""Luminous"": 0, ""Bajaj"": 0, ""Polycab"": 0, ""V-Guard"": 0, ""Anchor"": 0, ""Panasonic"": 0}",Atomberg,0.9949001669883728,positive,11.199110418925187,11.170553622417541
youtube,smart fan,46,https://www.youtube.com/watch?v=nmdHhYfZrcI,REVIEW | Xiaomi Smart Standing Fan 2 Pro – Our greatest fan,"The @XiaomiSouthAfrica Smart Standing Fan 2 Pro is a prime example of a smart fan, combining a portability (thanks, battery), ...",Stuff SA,7639.0,22.0,0.0,2025-03-25 14:01:01,"REVIEW | Xiaomi Smart Standing Fan 2 Pro – Our greatest fan The @XiaomiSouthAfrica Smart Standing Fan 2 Pro is a prime example of a smart fan, combining a portability (thanks, battery), ...","REVIEW | Xiaomi Smart Standing Fan 2 Pro – Our greatest fan The @XiaomiSouthAfrica Smart Standing Fan 2 Pro is a prime example of a smart fan, combining a portability (thanks, battery), ... REVIEW | Xiaomi Smart Standing Fan 2 Pro – Our greatest fan The @XiaomiSouthAfrica Smart Standing Fan 2 Pro is a prime example of a smart fan, combining a portability (thanks, battery), ...","{""Atomberg"": 0, ""Atomberg Renesa"": 0, ""Atomberg Efficio"": 0, ""Atomberg Studio"": 0, ""Orient"": 0, ""Havells"": 0, ""Usha"": 0, ""Crompton"": 0, ""Luminous"": 0, ""Bajaj"": 0, ""Polycab"": 0, ""V-Guard"": 0, ""Anchor"": 0, ""Panasonic"": 0}",,0.9991757273674011,positive,6.3053399940750845,6.302741334476911
youtube,smart fan,47,https://www.youtube.com/watch?v=YZWlaVhP0Jo,Stay cool in summer with Xiaomi Mi Smart Fan 2 Lite #smarthome #smarthomegadgets #xiaomi #techshorts,Xiaomi mi smart standing fan 2 lite → Follow me for more: Instagram — https://go.andi.yt/instagram Twitter ...,Andi Palmer,21444.0,201.0,4.0,2023-06-12 09:31:00,Stay cool in summer with Xiaomi Mi Smart Fan 2 Lite #smarthome #smarthomegadgets #xiaomi #techshorts Xiaomi mi smart standing fan 2 lite → Follow me for more: Instagram — https://go.andi.yt/instagram Twitter ...,Stay cool in summer with Xiaomi Mi Smart Fan 2 Lite #smarthome #smarthomegadgets #xiaomi #techshorts Xiaomi mi smart standing fan 2 lite → Follow me for more: Instagram — https://go.andi.yt/instagram Twitter ... Stay cool in summer with Xiaomi Mi Smart Fan 2 Lite #smarthome #smarthomegadgets #xiaomi #techshorts Xiaomi mi smart standing fan 2 lite → Follow me for more: Instagram — https://go.andi.yt/instagram Twitter ...,"{""Atomberg"": 0, ""Atomberg Renesa"": 0, ""Atomberg Efficio"": 0, ""Atomberg Studio"": 0, ""Orient"": 0, ""Havells"": 0, ""Usha"": 0, ""Crompton"": 0, ""Luminous"": 0, ""Bajaj"": 0, ""Polycab"": 0, ""V-Guard"": 0, ""Anchor"": 0, ""Panasonic"": 0}",,0.7463759183883667,positive,7.73737217863436,6.75618022218759
youtube,smart fan,48,https://www.youtube.com/watch?v=Qvalle4BBz0,Fast Fan Installation with HunterExpress® from Hunter #home #ceilingfan #diy #ceilingfaninstallation,The Georgetown is one of the easiest fans to install! This quick video shows you just how easy it is! Learn more about ...,Hunter Fan Company,687617.0,5398.0,64.0,2023-02-01 23:00:28,Fast Fan Installation with HunterExpress® from Hunter #home #ceilingfan #diy #ceilingfaninstallation The Georgetown is one of the easiest fans to install! This quick video shows you just how easy it is! Learn more about ...,Fast Fan Installation with HunterExpress® from Hunter #home #ceilingfan #diy #ceilingfaninstallation The Georgetown is one of the easiest fans to install! This quick video shows you just how easy it is! Learn more about ... Fast Fan Installation with HunterExpress® from Hunter #home #ceilingfan #diy #ceilingfaninstallation The Georgetown is one of the easiest fans to install! This quick video shows you just how easy it is! Learn more about ...,"{""Atomberg"": 0, ""Atomberg Renesa"": 0, ""Atomberg Efficio"": 0, ""Atomberg Studio"": 0, ""Orient"": 0, ""Havells"": 0, ""Usha"": 0, ""Crompton"": 0, ""Luminous"": 0, ""Bajaj"": 0, ""Polycab"": 0, ""V-Guard"": 0, ""Anchor"": 0, ""Panasonic"": 0}",,-0.7587497234344482,negative,11.06022267415025,1.3341408895076672
youtube,smart fan,49,https://www.youtube.com/watch?v=oh5ag0PXEds,Smart Register | Howeall Super Quiet Register Booster Fan,CHECK OUT TODAY'S PRICE ON AMAZON: ▻▻▻ https://geni.us/8P0gsK DISCLAIMER: Some of these links are affiliate links ...,Skinner's 100% Honest Reviews,27982.0,97.0,39.0,2023-06-02 15:00:48,Smart Register | Howeall Super Quiet Register Booster Fan CHECK OUT TODAY'S PRICE ON AMAZON: ▻▻▻ https://geni.us/8P0gsK DISCLAIMER: Some of these links are affiliate links ...,Smart Register | Howeall Super Quiet Register Booster Fan CHECK OUT TODAY'S PRICE ON AMAZON: ▻▻▻ https://geni.us/8P0gsK DISCLAIMER: Some of these links are affiliate links ... Smart Register | Howeall Super Quiet Register Booster Fan CHECK OUT TODAY'S PRICE ON AMAZON: ▻▻▻ https://geni.us/8P0gsK DISCLAIMER: Some of these links are affiliate links ...,"{""Atomberg"": 0, ""Atomberg Renesa"": 0, ""Atomberg Efficio"": 0, ""Atomberg Studio"": 0, ""Orient"": 0, ""Havells"": 0, ""Usha"": 0, ""Crompton"": 0, ""Luminous"": 0, ""Bajaj"": 0, ""Polycab"": 0, ""V-Guard"": 0, ""Anchor"": 0, ""Panasonic"": 0}",,-0.9938499331474304,negative,7.887989666161167,0.02425583188963459
youtube,smart fan,50,https://www.youtube.com/watch?v=MA3PvitcP2E,How to install a Crompton Blossom smart fan. #how #howto #reinventyourhome,,Interior Designer Vipin Verma,6110.0,54.0,3.0,2025-05-05 05:37:39,How to install a Crompton Blossom smart fan. #how #howto #reinventyourhome ,How to install a Crompton Blossom smart fan. #how #howto #reinventyourhome  How to install a Crompton Blossom smart fan. #how #howto #reinventyourhome ,"{""Atomberg"": 0, ""Atomberg Renesa"": 0, ""Atomberg Efficio"": 0, ""Atomberg Studio"": 0, ""Orient"": 0, ""Havells"": 0, ""Usha"": 0, ""Crompton"": 2, ""Luminous"": 0, ""Bajaj"": 0, ""Polycab"": 0, ""V-Guard"": 0, ""Anchor"": 0, ""Panasonic"": 0}",Crompton,-0.9715709686279297,negative,6.57153681461868,0.09341121313275473
