platform,query,rank,url,title,snippet,publisher,views,likes,comments,published_at,raw_text,scan_text,brand_mentions_json,dominant_brand,sentiment,sentiment_label,engagement,wsov_item
youtube,smart fan,97,https://www.youtube.com/watch?v=SRwx3F_N-jI,Transform Your Home With This Smart Ceiling Fan Installation,"In this video, I'm excited to share with you my experience with the Lumary Smart Ceiling Fan Installation, a game-changing ...",Miez Production,1387.0,15.0,3.0,2025-04-19 03:58:48,"Transform Your Home With This Smart Ceiling Fan Installation In this video, I'm excited to share with you my experience with the Lumary Smart Ceiling Fan Installation, a game-changing ...","Transform Your Home With This Smart Ceiling Fan Installation In this video, I'm excited to share with you my experience with the Lumary Smart Ceiling Fan Installation, a game-changing ... Transform Your Home With This Smart Ceiling Fan Installation In this video, I'm excited to share with you my experience with the Lumary Smart Ceiling Fan Installation, a game-changing ...","{""Atomberg"": 0, ""Atomberg Renesa"": 0, ""Atomberg Efficio"": 0, ""Atomberg Studio"": 0, ""Orient"": 0, ""Havells"": 0, ""Usha"": 0, ""Crompton"": 0, ""Luminous"": 0, ""Bajaj"": 0, ""Polycab"": 0, ""V-Guard"": 0, ""Anchor"": 0, ""Panasonic"": 0}",,0.999670147895813,positive,5.311777537423973,5.310901486925127
youtube,smart fan,98,https://www.youtube.com/watch?v=W8xtolhSUnE,Atomberg Aris Starlight Fan Review: Revolutionary Energy-Saving &amp; Smart Ceiling Fan!,AtombergAris #StarlightFan #BLDCFan #EnergySaver #SmartFan #HomeAppliances #CeilingFanReview #Atomberg In this ...,Anil's tec,6704.0,18.0,11.0,2024-08-18 10:42:58,Atomberg Aris Starlight Fan Review: Revolutionary Energy-Saving &amp; Smart Ceiling Fan! AtombergAris #StarlightFan #BLDCFan #EnergySaver #SmartFan #HomeAppliances #CeilingFanReview #Atomberg In this ...,Atomberg Aris Starlight Fan Review: Revolutionary Energy-Saving &amp; Smart Ceiling Fan! AtombergAris #StarlightFan #BLDCFan #EnergySaver #SmartFan #HomeAppliances #CeilingFanReview #Atomberg In this ... Atomberg Aris Starlight Fan Review: Revolutionary Energy-Saving &amp; Smart Ceiling Fan! AtombergAris #StarlightFan #BLDCFan #EnergySaver #SmartFan #HomeAppliances #CeilingFanReview #Atomberg In this ...,"{""Atomberg"": 4, ""Atomberg Renesa"": 0, ""Atomberg Efficio"": 0, ""Atomberg Studio"": 0, ""Orient"": 0, ""Havells"": 0, ""Usha"": 0, ""Crompton"": 0, ""Luminous"": 0, ""Bajaj"": 0, ""Polycab"": 0, ""V-Guard"": 0, ""Anchor"": 0, ""Panasonic"": 0}",Atomberg,0.9946058392524719,positive,6.4181876361582,6.400877268249583
youtube,smart fan,99,https://www.youtube.com/watch?v=x-hGuT5Gny0,Save upto 50% Electricity with this smart ceiling Aerosense BLDC Pro fan,Amazon Link: https://amzn.to/4j82wQP Website Link: http://bit.ly/3QRYkZj This is not just a regular ceiling fan! The Orient ...,Mr Techpedia,93992.0,3386.0,62.0,2025-04-03 13:01:33,Save upto 50% Electricity with this smart ceiling Aerosense BLDC Pro fan Amazon Link: https://amzn.to/4j82wQP Website Link: http://bit.ly/3QRYkZj This is not just a regular ceiling fan! The Orient ...,Save upto 50% Electricity with this smart ceiling Aerosense BLDC Pro fan Amazon Link: https://amzn.to/4j82wQP Website Link: http://bit.ly/3QRYkZj This is not just a regular ceiling fan! The Orient ... Save upto 50% Electricity with this smart ceiling Aerosense BLDC Pro fan Amazon Link: https://amzn.to/4j82wQP Website Link: http://bit.ly/3QRYkZj This is not just a regular ceiling fan! The Orient ...,"{""Atomberg"": 0, ""Atomberg Renesa"": 0, ""Atomberg Efficio"": 0, ""Atomberg Studio"": 0, ""Orient"": 2, ""Havells"": 0, ""Usha"": 0, ""Crompton"": 0, ""Luminous"": 0, ""Bajaj"": 0, ""Polycab"": 0, ""V-Guard"": 0, ""Anchor"": 0, ""Panasonic"": 0}",Orient,-0.9941018223762512,negative,9.723208782720974,0.028674606236641226
youtube,smart fan,100,https://www.youtube.com/watch?v=x86EZhUO-9o,[NEW] Best Premium Fan | Best Silent Ceiling Fan | with Best Smart Fan | Best BLDC Fan 2025,Are you on the lookout for a highly efficient BLDC fan that runs quietly and saves energy while also providing advanced features ...,SumitYPF,59661.0,430.0,58.0,2024-04-17 05:00:32,[NEW] Best Premium Fan | Best Silent Ceiling Fan | with Best Smart Fan | Best BLDC Fan 2025 Are you on the lookout for a highly efficient BLDC fan that runs quietly and saves energy while also providing advanced features ...,[NEW] Best Premium Fan | Best Silent Ceiling Fan | with Best Smart Fan | Best BLDC Fan 2025 Are you on the lookout for a highly efficient BLDC fan that runs quietly and saves energy while also providing advanced features ... [NEW] Best Premium Fan | Best Silent Ceiling Fan | with Best Smart Fan | Best BLDC Fan 2025 Are you on the lookout for a highly efficient BLDC fan that runs quietly and saves energy while also providing advanced features ...,"{""Atomberg"": 0, ""Atomberg Renesa"": 0, ""Atomberg Efficio"": 0, ""Atomberg Studio"": 0, ""Orient"": 0, ""Havells"": 0, ""Usha"": 0, ""Crompton"": 0, ""Luminous"": 0, ""Bajaj"": 0, ""Polycab"": 0, ""V-Guard"": 0, ""Anchor"": 0, ""Panasonic"": 0}",,0.999434769153595,positive,8.825456519905018,8.82296230977569
youtube,smart fan,101,https://www.youtube.com/watch?v=0a8l87McgCk,SMART ceiling fans?  game. changer. 🙌🏾,,Kayla Simone,125547.0,4100.0,54.0,2024-06-06 14:57:06,SMART ceiling fans?  game. changer. 🙌🏾 ,SMART ceiling fans?  game. changer. 🙌🏾  SMART ceiling fans?  game. changer. 🙌🏾 ,"{""Atomberg"": 0, ""Atomberg Renesa"": 0, ""Atomberg Efficio"": 0, ""Atomberg Studio"": 0, ""Orient"": 0, ""Havells"": 0, ""Usha"": 0, ""Crompton"": 0, ""Luminous"": 0, ""Bajaj"": 0, ""Polycab"": 0, ""V-Guard"": 0, ""Anchor"": 0, ""Panasonic"": 0}",,0.786912739276886,positive,9.940695216871132,8.881577460147916
youtube,smart fan,105,https://www.youtube.com/watch?v=dxe-soiD3to,"Xiaomi Smart Standing Fan 2 - Quiet Smart, Quite Cool",Unpacking the coolest from the lineup of #XiaomiTurns8 surprises! The #XiaomiSmartStandingFan2 brings you: -Silent BLDC ...,Xiaomi India,81077.0,268.0,38.0,2022-07-26 12:00:24,"Xiaomi Smart Standing Fan 2 - Quiet Smart, Quite Cool Unpacking the coolest from the lineup of #XiaomiTurns8 surprises! The #XiaomiSmartStandingFan2 brings you: -Silent BLDC ...","Xiaomi Smart Standing Fan 2 - Quiet Smart, Quite Cool Unpacking the coolest from the lineup of #XiaomiTurns8 surprises! The #XiaomiSmartStandingFan2 brings you: -Silent BLDC ... Xiaomi Smart Standing Fan 2 - Quiet Smart, Quite Cool Unpacking the coolest from the lineup of #XiaomiTurns8 surprises! The #XiaomiSmartStandingFan2 brings you: -Silent BLDC ...","{""Atomberg"": 0, ""Atomberg Renesa"": 0, ""Atomberg Efficio"": 0, ""Atomberg Studio"": 0, ""Orient"": 0, ""Havells"": 0, ""Usha"": 0, ""Crompton"": 0, ""Luminous"": 0, ""Bajaj"": 0, ""Polycab"": 0, ""V-Guard"": 0, ""Anchor"": 0, ""Panasonic"": 0}",,0.9996140599250793,positive,8.8266697384532,8.824966455663121
youtube,smart fan,112,https://www.youtube.com/watch?v=I8wq_0BucUg,POLYCAB SMART FAN #REMOTE CONTROLLER FAN,POLYCAB SMART FAN #REMOTE CONTROLLER FAN Remote control FAN jo ki polycab ਕੰਪਨੀ mein aap dekho gy light ...,M.S ELECTRICAL 💡💡,24130.0,,5.0,2025-02-20 04:42:22,POLYCAB SMART FAN #REMOTE CONTROLLER FAN POLYCAB SMART FAN #REMOTE CONTROLLER FAN Remote control FAN jo ki polycab ਕੰਪਨੀ mein aap dekho gy light ...,POLYCAB SMART FAN #REMOTE CONTROLLER FAN POLYCAB SMART FAN #REMOTE CONTROLLER FAN Remote control FAN jo ki polycab ਕੰਪਨੀ mein aap dekho gy light ... POLYCAB SMART FAN #REMOTE CONTROLLER FAN POLYCAB SMART FAN #REMOTE CONTROLLER FAN Remote control FAN jo ki polycab ਕੰਪਨੀ mein aap dekho gy light ...,"{""Atomberg"": 0, ""Atomberg Renesa"": 0, ""Atomberg Efficio"": 0, ""Atomberg Studio"": 0, ""Orient"": 0, ""Havells"": 0, ""Usha"": 0, ""Crompton"": 0, ""Luminous"": 0, ""Bajaj"": 0, ""Polycab"": 6, ""V-Guard"": 0, ""Anchor"": 0, ""Panasonic"": 0}",Polycab,-0.9946367144584656,negative,,
youtube,smart fan,114,https://www.youtube.com/watch?v=ZVLV6vsoo9U,Don&#39;t buy atomberg Fan.... #shorts,,The Survival Deepak •125K Views •5 Min Ago,917706.0,,565.0,2023-05-12 11:02:08,Don&#39;t buy atomberg Fan.... #shorts ,Don&#39;t buy atomberg Fan.... #shorts  Don&#39;t buy atomberg Fan.... #shorts ,"{""Atomberg"": 2, ""Atomberg Renesa"": 0, ""Atomberg Efficio"": 0, ""Atomberg Studio"": 0, ""Orient"": 0, ""Havells"": 0, ""Usha"": 0, ""Crompton"": 0, ""Luminous"": 0, ""Bajaj"": 0, ""Polycab"": 0, ""V-Guard"": 0, ""Anchor"": 0, ""Panasonic"": 0}",Atomberg,-0.9940709471702576,negative,,
youtube,smart fan,115,https://www.youtube.com/watch?v=arZ8JQupASM,"Coooool Breeze for Days 🌬️🍃🍃🍃🍃🍃LG Smart Inverter Fan Deals 😎👌🏾 Special Offer $38,999+GCT",,Enersave Solutions,21779.0,171.0,1.0,2023-07-16 21:45:27,"Coooool Breeze for Days 🌬️🍃🍃🍃🍃🍃LG Smart Inverter Fan Deals 😎👌🏾 Special Offer $38,999+GCT ","Coooool Breeze for Days 🌬️🍃🍃🍃🍃🍃LG Smart Inverter Fan Deals 😎👌🏾 Special Offer $38,999+GCT  Coooool Breeze for Days 🌬️🍃🍃🍃🍃🍃LG Smart Inverter Fan Deals 😎👌🏾 Special Offer $38,999+GCT ","{""Atomberg"": 0, ""Atomberg Renesa"": 0, ""Atomberg Efficio"": 0, ""Atomberg Studio"": 0, ""Orient"": 0, ""Havells"": 0, ""Usha"": 0, ""Crompton"": 0, ""Luminous"": 0, ""Bajaj"": 0, ""Polycab"": 0, ""V-Guard"": 0, ""Anchor"": 0, ""Panasonic"": 0}",,-0.8390100002288818,negative,7.606811498992201,0.6123102907408468
youtube,smart fan,119,https://www.youtube.com/watch?v=70yau4lE7IA,Atomberg BLDC Ceiling fan Renesa Halo new model price and features #atombergbldcfan #renesahalofan,Atomberg BLDC Ceiling fan Renesa Halo new model price and features #atombergbldcfan #renesahalofan #Renesahalobldcfan ...,TechnicaL KishoR,7074.0,51.0,4.0,2025-06-03 09:48:38,Atomberg BLDC Ceiling fan Renesa Halo new model price and features #atombergbldcfan #renesahalofan Atomberg BLDC Ceiling fan Renesa Halo new model price and features #atombergbldcfan #renesahalofan #Renesahalobldcfan ...,Atomberg BLDC Ceiling fan Renesa Halo new model price and features #atombergbldcfan #renesahalofan Atomberg BLDC Ceiling fan Renesa Halo new model price and features #atombergbldcfan #renesahalofan #Renesahalobldcfan ... Atomberg BLDC Ceiling fan Renesa Halo new model price and features #atombergbldcfan #renesahalofan Atomberg BLDC Ceiling fan Renesa Halo new model price and features #atombergbldcfan #renesahalofan #Renesahalobldcfan ...,"{""Atomberg"": 4, ""Atomberg Renesa"": 0, ""Atomberg Efficio"": 0, ""Atomberg Studio"": 0, ""Orient"": 0, ""Havells"": 0, ""Usha"": 0, ""Crompton"": 0, ""Luminous"": 0, ""Bajaj"": 0, ""Polycab"": 0, ""V-Guard"": 0, ""Anchor"": 0, ""Panasonic"": 0}",Atomberg,-0.9860449433326721,negative,6.664910540324701,0.046504602136451044
youtube,smart fan,120,https://www.youtube.com/watch?v=9vq2MhyqOfE,Atomberg Renesa Halo 1200 mm BLDC Ceiling Fan with Remote Control &amp; LED Indicators | Midnight Black,,Vikas tech hub,26710.0,134.0,5.0,2025-03-29 10:20:35,Atomberg Renesa Halo 1200 mm BLDC Ceiling Fan with Remote Control &amp; LED Indicators | Midnight Black ,Atomberg Renesa Halo 1200 mm BLDC Ceiling Fan with Remote Control &amp; LED Indicators | Midnight Black  Atomberg Renesa Halo 1200 mm BLDC Ceiling Fan with Remote Control &amp; LED Indicators | Midnight Black ,"{""Atomberg"": 2, ""Atomberg Renesa"": 2, ""Atomberg Efficio"": 0, ""Atomberg Studio"": 0, ""Orient"": 0, ""Havells"": 0, ""Usha"": 0, ""Crompton"": 0, ""Luminous"": 0, ""Bajaj"": 0, ""Polycab"": 0, ""V-Guard"": 0, ""Anchor"": 0, ""Panasonic"": 0}",Atomberg,-0.9848596453666687,negative,7.76645682719306,0.05879345530407997
youtube,smart fan,122,https://www.youtube.com/watch?v=AFcXyqEApms,Wahoo KICKR HEADWIND Smart Fan,https://www.wahoofitness.com/devices/bike-trainers/kickr-headwind-bluetooth-fan KICKR HEADWIND smart fan puts your workout ...,Wahoo Fitness,46922.0,61.0,7.0,2018-07-08 06:49:49,Wahoo KICKR HEADWIND Smart Fan https://www.wahoofitness.com/devices/bike-trainers/kickr-headwind-bluetooth-fan KICKR HEADWIND smart fan puts your workout ...,Wahoo KICKR HEADWIND Smart Fan https://www.wahoofitness.com/devices/bike-trainers/kickr-headwind-bluetooth-fan KICKR HEADWIND smart fan puts your workout ... Wahoo KICKR HEADWIND Smart Fan https://www.wahoofitness.com/devices/bike-trainers/kickr-headwind-bluetooth-fan KICKR HEADWIND smart fan puts your workout ...,"{""Atomberg"": 0, ""Atomberg Renesa"": 0, ""Atomberg Efficio"": 0, ""Atomberg Studio"": 0, ""Orient"": 0, ""Havells"": 0, ""Usha"": 0, ""Crompton"": 0, ""Luminous"": 0, ""Bajaj"": 0, ""Polycab"": 0, ""V-Guard"": 0, ""Anchor"": 0, ""Panasonic"": 0}",,0.520553469657898,positive,7.899842413286922,6.006066395637025
youtube,smart fan,124,https://www.youtube.com/watch?v=au-7UrhDwLI,kitchen Exhaust fan Smart Gadgets 😍 Antique Accessories and Appliances #kitchengadget #fanblower,,WA REVIEWS,2906247.0,8968.0,51.0,2025-05-04 07:55:40,kitchen Exhaust fan Smart Gadgets 😍 Antique Accessories and Appliances #kitchengadget #fanblower ,kitchen Exhaust fan Smart Gadgets 😍 Antique Accessories and Appliances #kitchengadget #fanblower  kitchen Exhaust fan Smart Gadgets 😍 Antique Accessories and Appliances #kitchengadget #fanblower ,"{""Atomberg"": 0, ""Atomberg Renesa"": 0, ""Atomberg Efficio"": 0, ""Atomberg Studio"": 0, ""Orient"": 0, ""Havells"": 0, ""Usha"": 0, ""Crompton"": 0, ""Luminous"": 0, ""Bajaj"": 0, ""Polycab"": 0, ""V-Guard"": 0, ""Anchor"": 0, ""Panasonic"": 0}",,0.8778010010719299,positive,12.055007287780859,11.318452376462153
youtube,smart fan,126,https://www.youtube.com/watch?v=hS-lvXHUaSA,"GAMERS, Is this the SMARTEST FAN ever? 🧠🌬 #gaming #setup #ps5  (DREO polyfan)",,CamXPetra,137863.0,5010.0,88.0,2024-04-12 11:08:36,"GAMERS, Is this the SMARTEST FAN ever? 🧠🌬 #gaming #setup #ps5  (DREO polyfan) ","GAMERS, Is this the SMARTEST FAN ever? 🧠🌬 #gaming #setup #ps5  (DREO polyfan)  GAMERS, Is this the SMARTEST FAN ever? 🧠🌬 #gaming #setup #ps5  (DREO polyfan) ","{""Atomberg"": 0, ""Atomberg Renesa"": 0, ""Atomberg Efficio"": 0, ""Atomberg Studio"": 0, ""Orient"": 0, ""Havells"": 0, ""Usha"": 0, ""Crompton"": 0, ""Luminous"": 0, ""Bajaj"": 0, ""Polycab"": 0, ""V-Guard"": 0, ""Anchor"": 0, ""Panasonic"": 0}",,0.9953576922416687,positive,10.10509465203798,10.081639172387066
youtube,smart fan,130,https://www.youtube.com/watch?v=7F-AOtAb_3c,Venetian black ceiling fan with chandelier #ceilingfan #fan #ceilingdecoration #interiorfan #trend,,Rishitha_Interiors,1413930.0,7799.0,116.0,2024-02-19 11:51:35,Venetian black ceiling fan with chandelier #ceilingfan #fan #ceilingdecoration #interiorfan #trend ,Venetian black ceiling fan with chandelier #ceilingfan #fan #ceilingdecoration #interiorfan #trend  Venetian black ceiling fan with chandelier #ceilingfan #fan #ceilingdecoration #interiorfan #trend ,"{""Atomberg"": 0, ""Atomberg Renesa"": 0, ""Atomberg Efficio"": 0, ""Atomberg Studio"": 0, ""Orient"": 0, ""Havells"": 0, ""Usha"": 0, ""Crompton"": 0, ""Luminous"": 0, ""Bajaj"": 0, ""Polycab"": 0, ""V-Guard"": 0, ""Anchor"": 0, ""Panasonic"": 0}",,-0.8396796584129333,negative,11.661911693189733,0.9348208331051924
youtube,smart fan,131,https://www.youtube.com/watch?v=C9q_KS7Ay60,Review the tower fan #costway #review #fans,,Costway,304384.0,1775.0,26.0,2024-03-28 16:00:08,Review the tower fan #costway #review #fans ,Review the tower fan #costway #review #fans  Review the tower fan #costway #review #fans ,"{""Atomberg"": 0, ""Atomberg Renesa"": 0, ""Atomberg Efficio"": 0, ""Atomberg Studio"": 0, ""Orient"": 0, ""Havells"": 0, ""Usha"": 0, ""Crompton"": 0, ""Luminous"": 0, ""Bajaj"": 0, ""Polycab"": 0, ""V-Guard"": 0, ""Anchor"": 0, ""Panasonic"": 0}",,0.780667781829834,positive,10.149848539559317,9.036754142422934
youtube,smart fan,134,https://www.youtube.com/watch?v=92SjuZdGqoA,Superfan A1 Durability Test #fyp #viral,,Electro Demolish,10162468.0,81444.0,609.0,2022-07-20 13:27:34,Superfan A1 Durability Test #fyp #viral ,Superfan A1 Durability Test #fyp #viral  Superfan A1 Durability Test #fyp #viral ,"{""Atomberg"": 0, ""Atomberg Renesa"": 0, ""Atomberg Efficio"": 0, ""Atomberg Studio"": 0, ""Orient"": 0, ""Havells"": 0, ""Usha"": 0, ""Crompton"": 0, ""Luminous"": 0, ""Bajaj"": 0, ""Polycab"": 0, ""V-Guard"": 0, ""Anchor"": 0, ""Panasonic"": 0}",,-0.9940434098243713,negative,13.714178052596075,0.040844869127458
youtube,smart fan,135,https://www.youtube.com/watch?v=CpAQeJ3pmY4,Solama Smart Fan #fan #shorts #fansound #shortvideo #viralvideo,Solama Smart Fan #fan #shorts #fansound #shortvideo #viralvideo.,Triangle Gamer,60014.0,262.0,1.0,2025-08-26 02:20:37,Solama Smart Fan #fan #shorts #fansound #shortvideo #viralvideo Solama Smart Fan #fan #shorts #fansound #shortvideo #viralvideo.,Solama Smart Fan #fan #shorts #fansound #shortvideo #viralvideo Solama Smart Fan #fan #shorts #fansound #shortvideo #viralvideo. Solama Smart Fan #fan #shorts #fansound #shortvideo #viralvideo Solama Smart Fan #fan #shorts #fansound #shortvideo #viralvideo.,"{""Atomberg"": 0, ""Atomberg Renesa"": 0, ""Atomberg Efficio"": 0, ""Atomberg Studio"": 0, ""Orient"": 0, ""Havells"": 0, ""Usha"": 0, ""Crompton"": 0, ""Luminous"": 0, ""Bajaj"": 0, ""Polycab"": 0, ""V-Guard"": 0, ""Anchor"": 0, ""Panasonic"": 0}",,-0.9406082630157471,negative,8.34237081368499,0.24773394659574352
youtube,smart fan,136,https://www.youtube.com/watch?v=npegALH_mzw,How to Connect &amp; Control Atomberg Fan from Your Phone,"How to Connect & Control Your Atomberg Fan from Your Phone, how to connect Atomberg smart ceiling Fan from any phone, how ...",MJ Tube,26279.0,83.0,3.0,2025-01-30 11:34:12,"How to Connect &amp; Control Atomberg Fan from Your Phone How to Connect & Control Your Atomberg Fan from Your Phone, how to connect Atomberg smart ceiling Fan from any phone, how ...","How to Connect &amp; Control Atomberg Fan from Your Phone How to Connect & Control Your Atomberg Fan from Your Phone, how to connect Atomberg smart ceiling Fan from any phone, how ... How to Connect &amp; Control Atomberg Fan from Your Phone How to Connect & Control Your Atomberg Fan from Your Phone, how to connect Atomberg smart ceiling Fan from any phone, how ...","{""Atomberg"": 6, ""Atomberg Renesa"": 0, ""Atomberg Efficio"": 0, ""Atomberg Studio"": 0, ""Orient"": 0, ""Havells"": 0, ""Usha"": 0, ""Crompton"": 0, ""Luminous"": 0, ""Bajaj"": 0, ""Polycab"": 0, ""V-Guard"": 0, ""Anchor"": 0, ""Panasonic"": 0}",Atomberg,-0.973063588142395,negative,7.573812559324111,0.10200566721512776
youtube,smart fan,137,https://www.youtube.com/watch?v=072gmQvmzY0,5 Best Smart Ceiling Fans 2025 | Best :Ceiling Fans 2025,Links of the Products: WAC Lighting Malibu Indoor and Outdoor 3-Blade Smart Home Ceiling Fan 70in Brushed Nickel Ebony with ...,Gadget Hub,1634.0,11.0,0.0,2025-04-02 15:05:13,5 Best Smart Ceiling Fans 2025 | Best :Ceiling Fans 2025 Links of the Products: WAC Lighting Malibu Indoor and Outdoor 3-Blade Smart Home Ceiling Fan 70in Brushed Nickel Ebony with ...,5 Best Smart Ceiling Fans 2025 | Best :Ceiling Fans 2025 Links of the Products: WAC Lighting Malibu Indoor and Outdoor 3-Blade Smart Home Ceiling Fan 70in Brushed Nickel Ebony with ... 5 Best Smart Ceiling Fans 2025 | Best :Ceiling Fans 2025 Links of the Products: WAC Lighting Malibu Indoor and Outdoor 3-Blade Smart Home Ceiling Fan 70in Brushed Nickel Ebony with ...,"{""Atomberg"": 0, ""Atomberg Renesa"": 0, ""Atomberg Efficio"": 0, ""Atomberg Studio"": 0, ""Orient"": 0, ""Havells"": 0, ""Usha"": 0, ""Crompton"": 0, ""Luminous"": 0, ""Bajaj"": 0, ""Polycab"": 0, ""V-Guard"": 0, ""Anchor"": 0, ""Panasonic"": 0}",,0.9973599314689636,positive,5.185110844935212,5.178266320949388
youtube,smart fan,138,https://www.youtube.com/watch?v=zXfnfkkiVog,Xiaomi Smart Fan Pro VS. Xiaomi Smart Fan 2S | COMPARISON | MultiMind Enterprise,The Xiaomi Smart Fan 2S and Xiaomi Smart Fan Pro are unquestionably the greatest options for a portable cordless fan to use ...,MultiMind Enterprise,43648.0,126.0,1.0,2021-08-20 07:58:37,Xiaomi Smart Fan Pro VS. Xiaomi Smart Fan 2S | COMPARISON | MultiMind Enterprise The Xiaomi Smart Fan 2S and Xiaomi Smart Fan Pro are unquestionably the greatest options for a portable cordless fan to use ...,Xiaomi Smart Fan Pro VS. Xiaomi Smart Fan 2S | COMPARISON | MultiMind Enterprise The Xiaomi Smart Fan 2S and Xiaomi Smart Fan Pro are unquestionably the greatest options for a portable cordless fan to use ... Xiaomi Smart Fan Pro VS. Xiaomi Smart Fan 2S | COMPARISON | MultiMind Enterprise The Xiaomi Smart Fan 2S and Xiaomi Smart Fan Pro are unquestionably the greatest options for a portable cordless fan to use ...,"{""Atomberg"": 0, ""Atomberg Renesa"": 0, ""Atomberg Efficio"": 0, ""Atomberg Studio"": 0, ""Orient"": 0, ""Havells"": 0, ""Usha"": 0, ""Crompton"": 0, ""Luminous"": 0, ""Bajaj"": 0, ""Polycab"": 0, ""V-Guard"": 0, ""Anchor"": 0, ""Panasonic"": 0}",,0.9981701374053955,positive,7.932932234892298,7.925674146911217
youtube,smart fan,140,https://www.youtube.com/watch?v=13tR6al1IkE,The Best Standing Fans To Buy In 2024,"Which fan is the best? Xiaomi Mi Fan 2, Rowenta Turbo Silence, Dyson TP00 Pure Cool, Duux Whisper, Fuave FF9020W or the ...",UNFILTERD,113742.0,622.0,52.0,2023-07-25 13:10:37,"The Best Standing Fans To Buy In 2024 Which fan is the best? Xiaomi Mi Fan 2, Rowenta Turbo Silence, Dyson TP00 Pure Cool, Duux Whisper, Fuave FF9020W or the ...","The Best Standing Fans To Buy In 2024 Which fan is the best? Xiaomi Mi Fan 2, Rowenta Turbo Silence, Dyson TP00 Pure Cool, Duux Whisper, Fuave FF9020W or the ... The Best Standing Fans To Buy In 2024 Which fan is the best? Xiaomi Mi Fan 2, Rowenta Turbo Silence, Dyson TP00 Pure Cool, Duux Whisper, Fuave FF9020W or the ...","{""Atomberg"": 0, ""Atomberg Renesa"": 0, ""Atomberg Efficio"": 0, ""Atomberg Studio"": 0, ""Orient"": 0, ""Havells"": 0, ""Usha"": 0, ""Crompton"": 0, ""Luminous"": 0, ""Bajaj"": 0, ""Polycab"": 0, ""V-Guard"": 0, ""Anchor"": 0, ""Panasonic"": 0}",,0.9979391694068909,positive,9.312411224866302,9.302815573892394
youtube,smart fan,141,https://www.youtube.com/watch?v=fgNFx37iu9U,How To Install Atomberg Renesa Smart Ceiling Fan,"How To Install Atomberg Renesa Smart Ceiling Fan best ceiling fan,atomberg renesa 1200 mm,bldc ceiling fan best ceiling fan ...",TechinfoG,80165.0,690.0,96.0,2024-07-12 13:30:30,"How To Install Atomberg Renesa Smart Ceiling Fan How To Install Atomberg Renesa Smart Ceiling Fan best ceiling fan,atomberg renesa 1200 mm,bldc ceiling fan best ceiling fan ...","How To Install Atomberg Renesa Smart Ceiling Fan How To Install Atomberg Renesa Smart Ceiling Fan best ceiling fan,atomberg renesa 1200 mm,bldc ceiling fan best ceiling fan ... How To Install Atomberg Renesa Smart Ceiling Fan How To Install Atomberg Renesa Smart Ceiling Fan best ceiling fan,atomberg renesa 1200 mm,bldc ceiling fan best ceiling fan ...","{""Atomberg"": 6, ""Atomberg Renesa"": 6, ""Atomberg Efficio"": 0, ""Atomberg Studio"": 0, ""Orient"": 0, ""Havells"": 0, ""Usha"": 0, ""Crompton"": 0, ""Luminous"": 0, ""Bajaj"": 0, ""Polycab"": 0, ""V-Guard"": 0, ""Anchor"": 0, ""Panasonic"": 0}",Atomberg,0.9495299458503723,positive,9.194025903270807,8.962014410675229
youtube,smart fan,143,https://www.youtube.com/watch?v=ke-24IoZBLM,Lutron Caseta Smart Fan Control Review - with HomeKit support!,"At less than $60 USD, the new Lutron Caseta Wireless Fan Control is a lot cheaper than $200+ smart fan alternatives, but is it the ...",Eric Welander,46937.0,423.0,49.0,2019-04-20 14:53:05,"Lutron Caseta Smart Fan Control Review - with HomeKit support! At less than $60 USD, the new Lutron Caseta Wireless Fan Control is a lot cheaper than $200+ smart fan alternatives, but is it the ...","Lutron Caseta Smart Fan Control Review - with HomeKit support! At less than $60 USD, the new Lutron Caseta Wireless Fan Control is a lot cheaper than $200+ smart fan alternatives, but is it the ... Lutron Caseta Smart Fan Control Review - with HomeKit support! At less than $60 USD, the new Lutron Caseta Wireless Fan Control is a lot cheaper than $200+ smart fan alternatives, but is it the ...","{""Atomberg"": 0, ""Atomberg Renesa"": 0, ""Atomberg Efficio"": 0, ""Atomberg Studio"": 0, ""Orient"": 0, ""Havells"": 0, ""Usha"": 0, ""Crompton"": 0, ""Luminous"": 0, ""Bajaj"": 0, ""Polycab"": 0, ""V-Guard"": 0, ""Anchor"": 0, ""Panasonic"": 0}",,-0.9875752329826355,negative,8.660072053660283,0.053799688810159174
youtube,smart fan,144,https://www.youtube.com/watch?v=Lg_umUVvRzg,Best BLDC Smart Fan in 2024: Atomberg Renesa Smart+ || Review,BLDCFan #SmartFan #Atomberg Today I am unboxing one of the best smart BLDC ceiling fan in the market from Atomberg.,Five tag,45452.0,366.0,29.0,2024-04-07 11:30:15,Best BLDC Smart Fan in 2024: Atomberg Renesa Smart+ || Review BLDCFan #SmartFan #Atomberg Today I am unboxing one of the best smart BLDC ceiling fan in the market from Atomberg.,Best BLDC Smart Fan in 2024: Atomberg Renesa Smart+ || Review BLDCFan #SmartFan #Atomberg Today I am unboxing one of the best smart BLDC ceiling fan in the market from Atomberg. Best BLDC Smart Fan in 2024: Atomberg Renesa Smart+ || Review BLDCFan #SmartFan #Atomberg Today I am unboxing one of the best smart BLDC ceiling fan in the market from Atomberg.,"{""Atomberg"": 6, ""Atomberg Renesa"": 2, ""Atomberg Efficio"": 0, ""Atomberg Studio"": 0, ""Orient"": 0, ""Havells"": 0, ""Usha"": 0, ""Crompton"": 0, ""Luminous"": 0, ""Bajaj"": 0, ""Polycab"": 0, ""V-Guard"": 0, ""Anchor"": 0, ""Panasonic"": 0}",Atomberg,0.9992727637290955,positive,8.546388754999354,8.54328113305541
