platform,query,rank,url,title,snippet,publisher,views,likes,comments,published_at,raw_text,scan_text,brand_mentions_json,dominant_brand,sentiment,sentiment_label,engagement,wsov_item
google,smart fan,63,https://www.trainerroad.com/forum/t/elite-aria-smart-trainer-fan/87367,Elite Aria Smart Trainer Fan - Equipment - TrainerRoad,"Oct 9, 2023 ... The Elite Aria fan is seemingly the smartest of smart trainer fans out there today, linking to a wide assortment of indoor cycling tech.",www.trainerroad.com,,,,,"Elite Aria Smart Trainer Fan - Equipment - TrainerRoad Oct 9, 2023 ... The Elite Aria fan is seemingly the smartest of smart trainer fans out there today, linking to a wide assortment of indoor cycling tech.","Elite Aria Smart Trainer Fan - Equipment - TrainerRoad Oct 9, 2023 ... The Elite Aria fan is seemingly the smartest of smart trainer fans out there today, linking to a wide assortment of indoor cycling tech. Elite Aria Smart Trainer Fan - Equipment - TrainerRoad Oct 9, 2023 ... The Elite Aria fan is seemingly the smartest of smart trainer fans out there today, linking to a wide assortment of indoor cycling tech.","{""Atomberg"": 0, ""Atomberg Renesa"": 0, ""Atomberg Efficio"": 0, ""Atomberg Studio"": 0, ""Orient"": 0, ""Havells"": 0, ""Usha"": 0, ""Crompton"": 0, ""Luminous"": 0, ""Bajaj"": 0, ""Polycab"": 0, ""V-Guard"": 0, ""Anchor"": 0, ""Panasonic"": 0}",,0.9953755140304565,positive,,
google,smart fan,64,https://lumeo.co.za/products/lumeo-smart-fan,Lumeo Smart Fan,"The ultimate lightweight and portable cooling solution. Weighing just 940 g, it's perfect for camping, battling load-shedding, or outdoor events.",lumeo.co.za,,,,,"Lumeo Smart Fan The ultimate lightweight and portable cooling solution. Weighing just 940 g, it's perfect for camping, battling load-shedding, or outdoor events.","Lumeo Smart Fan The ultimate lightweight and portable cooling solution. Weighing just 940 g, it's perfect for camping, battling load-shedding, or outdoor events. Lumeo Smart Fan The ultimate lightweight and portable cooling solution. Weighing just 940 g, it's perfect for camping, battling load-shedding, or outdoor events.","{""Atomberg"": 0, ""Atomberg Renesa"": 0, ""Atomberg Efficio"": 0, ""Atomberg Studio"": 0, ""Orient"": 0, ""Havells"": 0, ""Usha"": 0, ""Crompton"": 0, ""Luminous"": 0, ""Bajaj"": 0, ""Polycab"": 0, ""V-Guard"": 0, ""Anchor"": 0, ""Panasonic"": 0}",,0.9969876408576965,positive,,
google,smart fan,65,https://forums.tomshardware.com/threads/liquid-cooler-pump-fan-control.3791350/,[SOLVED] - Liquid Cooler - Pump Fan Control | Tom's Hardware ...,"Jan 3, 2023 ... My question is related to the PUMP FUN settings... it is a 3-pin connector (DC) and the Smart Fan Mode is OFF by default, and the FAN Speed in both BIOS and ...",forums.tomshardware.com,,,,,"[SOLVED] - Liquid Cooler - Pump Fan Control | Tom's Hardware ... Jan 3, 2023 ... My question is related to the PUMP FUN settings... it is a 3-pin connector (DC) and the Smart Fan Mode is OFF by default, and the FAN Speed in both BIOS and ...","[SOLVED] - Liquid Cooler - Pump Fan Control | Tom's Hardware ... Jan 3, 2023 ... My question is related to the PUMP FUN settings... it is a 3-pin connector (DC) and the Smart Fan Mode is OFF by default, and the FAN Speed in both BIOS and ... [SOLVED] - Liquid Cooler - Pump Fan Control | Tom's Hardware ... Jan 3, 2023 ... My question is related to the PUMP FUN settings... it is a 3-pin connector (DC) and the Smart Fan Mode is OFF by default, and the FAN Speed in both BIOS and ...","{""Atomberg"": 0, ""Atomberg Renesa"": 0, ""Atomberg Efficio"": 0, ""Atomberg Studio"": 0, ""Orient"": 0, ""Havells"": 0, ""Usha"": 0, ""Crompton"": 0, ""Luminous"": 0, ""Bajaj"": 0, ""Polycab"": 0, ""V-Guard"": 0, ""Anchor"": 0, ""Panasonic"": 0}",,-0.9976168870925903,negative,,
google,smart fan,66,https://www.broan-nutone.com/en-us/product/ventilationfans/vc110cct,VC110CCT | Broan® 110 CFM Voice Controlled Smart Exhaust Fan ...,Features · Sensonic Voice™ controlled fan with Alexa Built-in or connected Google assistant-enabled devices allows you to ask questions or give commands ...,www.broan-nutone.com,,,,,VC110CCT | Broan® 110 CFM Voice Controlled Smart Exhaust Fan ... Features · Sensonic Voice™ controlled fan with Alexa Built-in or connected Google assistant-enabled devices allows you to ask questions or give commands ...,VC110CCT | Broan® 110 CFM Voice Controlled Smart Exhaust Fan ... Features · Sensonic Voice™ controlled fan with Alexa Built-in or connected Google assistant-enabled devices allows you to ask questions or give commands ... VC110CCT | Broan® 110 CFM Voice Controlled Smart Exhaust Fan ... Features · Sensonic Voice™ controlled fan with Alexa Built-in or connected Google assistant-enabled devices allows you to ask questions or give commands ...,"{""Atomberg"": 0, ""Atomberg Renesa"": 0, ""Atomberg Efficio"": 0, ""Atomberg Studio"": 0, ""Orient"": 0, ""Havells"": 0, ""Usha"": 0, ""Crompton"": 0, ""Luminous"": 0, ""Bajaj"": 0, ""Polycab"": 0, ""V-Guard"": 0, ""Anchor"": 0, ""Panasonic"": 0}",,-0.962553858757019,negative,,
google,smart fan,67,https://www.lampsplus.com/products/ceiling-fans/usage_smart-fans/,Smart Ceiling Fans | Lamps Plus,"A smart ceiling fan is a technologically advanced version of a traditional ceiling fan that can be controlled remotely via a smartphone, ...",www.lampsplus.com,,,,,"Smart Ceiling Fans | Lamps Plus A smart ceiling fan is a technologically advanced version of a traditional ceiling fan that can be controlled remotely via a smartphone, ...","Smart Ceiling Fans | Lamps Plus A smart ceiling fan is a technologically advanced version of a traditional ceiling fan that can be controlled remotely via a smartphone, ... Smart Ceiling Fans | Lamps Plus A smart ceiling fan is a technologically advanced version of a traditional ceiling fan that can be controlled remotely via a smartphone, ...","{""Atomberg"": 0, ""Atomberg Renesa"": 0, ""Atomberg Efficio"": 0, ""Atomberg Studio"": 0, ""Orient"": 0, ""Havells"": 0, ""Usha"": 0, ""Crompton"": 0, ""Luminous"": 0, ""Bajaj"": 0, ""Polycab"": 0, ""V-Guard"": 0, ""Anchor"": 0, ""Panasonic"": 0}",,0.8190344572067261,positive,,
google,smart fan,68,https://www.treadmillreviewguru.com/cycplus-smart-fan-review/,Cycplus High-Power Smart Fan Review | A Cooler Way to Train,"May 27, 2025 ... Cycplus High-Power Smart Fan Review: Bottom Line · Adapts based on speed, heart rate, and power · 50 km/h max air speed · Remote control for ...",www.treadmillreviewguru.com,,,,,"Cycplus High-Power Smart Fan Review | A Cooler Way to Train May 27, 2025 ... Cycplus High-Power Smart Fan Review: Bottom Line · Adapts based on speed, heart rate, and power · 50 km/h max air speed · Remote control for ...","Cycplus High-Power Smart Fan Review | A Cooler Way to Train May 27, 2025 ... Cycplus High-Power Smart Fan Review: Bottom Line · Adapts based on speed, heart rate, and power · 50 km/h max air speed · Remote control for ... Cycplus High-Power Smart Fan Review | A Cooler Way to Train May 27, 2025 ... Cycplus High-Power Smart Fan Review: Bottom Line · Adapts based on speed, heart rate, and power · 50 km/h max air speed · Remote control for ...","{""Atomberg"": 0, ""Atomberg Renesa"": 0, ""Atomberg Efficio"": 0, ""Atomberg Studio"": 0, ""Orient"": 0, ""Havells"": 0, ""Usha"": 0, ""Crompton"": 0, ""Luminous"": 0, ""Bajaj"": 0, ""Polycab"": 0, ""V-Guard"": 0, ""Anchor"": 0, ""Panasonic"": 0}",,-0.9722428917884827,negative,,
google,smart fan,69,https://decorasmartsupport.leviton.com/hc/en-us/articles/13653916917019-D24SF-Decora-Smart-Wi-Fi-2nd-Gen-Fan-Speed-Controller-Single-Pole-or-3-Way,"D24SF: Decora Smart Wi-Fi (2nd Gen) Fan Speed Controller, Single ...","Apr 19, 2024 ... Below is a link to the manual for the D24SF. For more information please visit the product page which includes manuals, specifications and marketing materials.",decorasmartsupport.leviton.com,,,,,"D24SF: Decora Smart Wi-Fi (2nd Gen) Fan Speed Controller, Single ... Apr 19, 2024 ... Below is a link to the manual for the D24SF. For more information please visit the product page which includes manuals, specifications and marketing materials.","D24SF: Decora Smart Wi-Fi (2nd Gen) Fan Speed Controller, Single ... Apr 19, 2024 ... Below is a link to the manual for the D24SF. For more information please visit the product page which includes manuals, specifications and marketing materials. D24SF: Decora Smart Wi-Fi (2nd Gen) Fan Speed Controller, Single ... Apr 19, 2024 ... Below is a link to the manual for the D24SF. For more information please visit the product page which includes manuals, specifications and marketing materials.","{""Atomberg"": 0, ""Atomberg Renesa"": 0, ""Atomberg Efficio"": 0, ""Atomberg Studio"": 0, ""Orient"": 0, ""Havells"": 0, ""Usha"": 0, ""Crompton"": 0, ""Luminous"": 0, ""Bajaj"": 0, ""Polycab"": 0, ""V-Guard"": 0, ""Anchor"": 0, ""Panasonic"": 0}",,-0.9950127005577087,negative,,
google,smart fan,70,https://www.homecontrols.com/Leviton-Decora-Smart-Fan-Speed-Controller-2nd-Gen-LVD24SF1BW,Leviton Decora Smart Fan Speed Controller (2nd Gen),This Wi-Fi connected 4-speed fan wall switch controls a wired 120VAC fan up to 1.5 Amps with On/Off and 4 speed settings.,www.homecontrols.com,,,,,Leviton Decora Smart Fan Speed Controller (2nd Gen) This Wi-Fi connected 4-speed fan wall switch controls a wired 120VAC fan up to 1.5 Amps with On/Off and 4 speed settings.,Leviton Decora Smart Fan Speed Controller (2nd Gen) This Wi-Fi connected 4-speed fan wall switch controls a wired 120VAC fan up to 1.5 Amps with On/Off and 4 speed settings. Leviton Decora Smart Fan Speed Controller (2nd Gen) This Wi-Fi connected 4-speed fan wall switch controls a wired 120VAC fan up to 1.5 Amps with On/Off and 4 speed settings.,"{""Atomberg"": 0, ""Atomberg Renesa"": 0, ""Atomberg Efficio"": 0, ""Atomberg Studio"": 0, ""Orient"": 0, ""Havells"": 0, ""Usha"": 0, ""Crompton"": 0, ""Luminous"": 0, ""Bajaj"": 0, ""Polycab"": 0, ""V-Guard"": 0, ""Anchor"": 0, ""Panasonic"": 0}",,-0.9909771680831909,negative,,
google,smart fan,71,https://schonbek.com/product/atomic-smart-fan/,Atomic Smart Fan | Schonbek,"Jewelry-inspired lighting handcrafted with brilliantly faceted Radiance Crystal, rich metallics and Swarovski Pearls.",schonbek.com,,,,,"Atomic Smart Fan | Schonbek Jewelry-inspired lighting handcrafted with brilliantly faceted Radiance Crystal, rich metallics and Swarovski Pearls.","Atomic Smart Fan | Schonbek Jewelry-inspired lighting handcrafted with brilliantly faceted Radiance Crystal, rich metallics and Swarovski Pearls. Atomic Smart Fan | Schonbek Jewelry-inspired lighting handcrafted with brilliantly faceted Radiance Crystal, rich metallics and Swarovski Pearls.","{""Atomberg"": 0, ""Atomberg Renesa"": 0, ""Atomberg Efficio"": 0, ""Atomberg Studio"": 0, ""Orient"": 0, ""Havells"": 0, ""Usha"": 0, ""Crompton"": 0, ""Luminous"": 0, ""Bajaj"": 0, ""Polycab"": 0, ""V-Guard"": 0, ""Anchor"": 0, ""Panasonic"": 0}",,0.9997065663337708,positive,,
google,smart fan,73,https://www.tenforums.com/pc-custom-builds-overclocking/205455-does-msi-bios-smart-fan-mode-override-any-temp-set-points.html,Does MSI BIOS Smart Fan Mode Override Any Temp Set Points,"Jun 13, 2023 ... This is my first MSI motherboard I've owned. It seems no matter what cpu fan temp set point I set, smart fan mode overrides it. Here's a couple of screen shots.",www.tenforums.com,,,,,"Does MSI BIOS Smart Fan Mode Override Any Temp Set Points Jun 13, 2023 ... This is my first MSI motherboard I've owned. It seems no matter what cpu fan temp set point I set, smart fan mode overrides it. Here's a couple of screen shots.","Does MSI BIOS Smart Fan Mode Override Any Temp Set Points Jun 13, 2023 ... This is my first MSI motherboard I've owned. It seems no matter what cpu fan temp set point I set, smart fan mode overrides it. Here's a couple of screen shots. Does MSI BIOS Smart Fan Mode Override Any Temp Set Points Jun 13, 2023 ... This is my first MSI motherboard I've owned. It seems no matter what cpu fan temp set point I set, smart fan mode overrides it. Here's a couple of screen shots.","{""Atomberg"": 0, ""Atomberg Renesa"": 0, ""Atomberg Efficio"": 0, ""Atomberg Studio"": 0, ""Orient"": 0, ""Havells"": 0, ""Usha"": 0, ""Crompton"": 0, ""Luminous"": 0, ""Bajaj"": 0, ""Polycab"": 0, ""V-Guard"": 0, ""Anchor"": 0, ""Panasonic"": 0}",,-0.9984304308891296,negative,,
google,smart fan,74,https://winraid.level1techs.com/t/how-to-modify-smart-fan-options-in-aptio-bios-for-kilisre-dual-x99-motherboard/37161,How to modify Smart Fan options in Aptio BIOS for Kilisre dual X99 ...,"May 16, 2021 ... The Smart Fan settings in the BIOS only allow for changing the four temperature thresholds T1, T2, T3, and T4. The CPU fan speed (PWM duty cycle) is preset for ...",winraid.level1techs.com,,,,,"How to modify Smart Fan options in Aptio BIOS for Kilisre dual X99 ... May 16, 2021 ... The Smart Fan settings in the BIOS only allow for changing the four temperature thresholds T1, T2, T3, and T4. The CPU fan speed (PWM duty cycle) is preset for ...","How to modify Smart Fan options in Aptio BIOS for Kilisre dual X99 ... May 16, 2021 ... The Smart Fan settings in the BIOS only allow for changing the four temperature thresholds T1, T2, T3, and T4. The CPU fan speed (PWM duty cycle) is preset for ... How to modify Smart Fan options in Aptio BIOS for Kilisre dual X99 ... May 16, 2021 ... The Smart Fan settings in the BIOS only allow for changing the four temperature thresholds T1, T2, T3, and T4. The CPU fan speed (PWM duty cycle) is preset for ...","{""Atomberg"": 0, ""Atomberg Renesa"": 0, ""Atomberg Efficio"": 0, ""Atomberg Studio"": 0, ""Orient"": 0, ""Havells"": 0, ""Usha"": 0, ""Crompton"": 0, ""Luminous"": 0, ""Bajaj"": 0, ""Polycab"": 0, ""V-Guard"": 0, ""Anchor"": 0, ""Panasonic"": 0}",,-0.9974125027656555,negative,,
google,smart fan,75,https://www.gigabyte.com/mb/am4/cooling,Smart Fan 5,Smart Fan 5 allows users to interchange their fan headers to reflect different thermal sensors at different locations on the motherboard.,www.gigabyte.com,,,,,Smart Fan 5 Smart Fan 5 allows users to interchange their fan headers to reflect different thermal sensors at different locations on the motherboard.,Smart Fan 5 Smart Fan 5 allows users to interchange their fan headers to reflect different thermal sensors at different locations on the motherboard. Smart Fan 5 Smart Fan 5 allows users to interchange their fan headers to reflect different thermal sensors at different locations on the motherboard.,"{""Atomberg"": 0, ""Atomberg Renesa"": 0, ""Atomberg Efficio"": 0, ""Atomberg Studio"": 0, ""Orient"": 0, ""Havells"": 0, ""Usha"": 0, ""Crompton"": 0, ""Luminous"": 0, ""Bajaj"": 0, ""Polycab"": 0, ""V-Guard"": 0, ""Anchor"": 0, ""Panasonic"": 0}",,0.9477351903915405,positive,,
google,smart fan,76,https://www.espn.com/mens-college-basketball/story/_/id/10426105/marcus-smart-oklahoma-state-cowboys-shoves-fan,Marcus Smart of Oklahoma State Cowboys shoves fan - ESPN,"Feb 8, 2014 ... The fan who Smart shoved is Jeff Orr, an air traffic controller in Waco, Texas, who travels thousands of miles each year to attend Texas Tech ...",www.espn.com,,,,,"Marcus Smart of Oklahoma State Cowboys shoves fan - ESPN Feb 8, 2014 ... The fan who Smart shoved is Jeff Orr, an air traffic controller in Waco, Texas, who travels thousands of miles each year to attend Texas Tech ...","Marcus Smart of Oklahoma State Cowboys shoves fan - ESPN Feb 8, 2014 ... The fan who Smart shoved is Jeff Orr, an air traffic controller in Waco, Texas, who travels thousands of miles each year to attend Texas Tech ... Marcus Smart of Oklahoma State Cowboys shoves fan - ESPN Feb 8, 2014 ... The fan who Smart shoved is Jeff Orr, an air traffic controller in Waco, Texas, who travels thousands of miles each year to attend Texas Tech ...","{""Atomberg"": 0, ""Atomberg Renesa"": 0, ""Atomberg Efficio"": 0, ""Atomberg Studio"": 0, ""Orient"": 0, ""Havells"": 0, ""Usha"": 0, ""Crompton"": 0, ""Luminous"": 0, ""Bajaj"": 0, ""Polycab"": 0, ""V-Guard"": 0, ""Anchor"": 0, ""Panasonic"": 0}",,-0.9885731935501099,negative,,
google,smart fan,77,https://lights.com/products/lorain-led-ceiling-fan-54-inch-brushed-nickel-and-white,"Lorain LED Light Ceiling Fan 54"", Brushed Nickel and White Smart ...","Jun 13, 2025 ... • Smart fan technology with Smart by Bond app provides seamless integration with Alexa, Google, and iHome for voice control and automated ...",lights.com,,,,,"Lorain LED Light Ceiling Fan 54"", Brushed Nickel and White Smart ... Jun 13, 2025 ... • Smart fan technology with Smart by Bond app provides seamless integration with Alexa, Google, and iHome for voice control and automated ...","Lorain LED Light Ceiling Fan 54"", Brushed Nickel and White Smart ... Jun 13, 2025 ... • Smart fan technology with Smart by Bond app provides seamless integration with Alexa, Google, and iHome for voice control and automated ... Lorain LED Light Ceiling Fan 54"", Brushed Nickel and White Smart ... Jun 13, 2025 ... • Smart fan technology with Smart by Bond app provides seamless integration with Alexa, Google, and iHome for voice control and automated ...","{""Atomberg"": 0, ""Atomberg Renesa"": 0, ""Atomberg Efficio"": 0, ""Atomberg Studio"": 0, ""Orient"": 0, ""Havells"": 0, ""Usha"": 0, ""Crompton"": 0, ""Luminous"": 0, ""Bajaj"": 0, ""Polycab"": 0, ""V-Guard"": 0, ""Anchor"": 0, ""Panasonic"": 0}",,0.9962047934532166,positive,,
google,smart fan,78,https://lights.com/products/lorain-led-ceiling-fan-54-inch-brushed-nickel-and-matte-black,"Lorain LED Light Ceiling Fan 54"", Brushed Nickel and Matte Black ...","Jul 1, 2025 ... • Smart fan technology with Smart by Bond app provides seamless integration with Alexa, Google, and iHome for voice control and automated ...",lights.com,,,,,"Lorain LED Light Ceiling Fan 54"", Brushed Nickel and Matte Black ... Jul 1, 2025 ... • Smart fan technology with Smart by Bond app provides seamless integration with Alexa, Google, and iHome for voice control and automated ...","Lorain LED Light Ceiling Fan 54"", Brushed Nickel and Matte Black ... Jul 1, 2025 ... • Smart fan technology with Smart by Bond app provides seamless integration with Alexa, Google, and iHome for voice control and automated ... Lorain LED Light Ceiling Fan 54"", Brushed Nickel and Matte Black ... Jul 1, 2025 ... • Smart fan technology with Smart by Bond app provides seamless integration with Alexa, Google, and iHome for voice control and automated ...","{""Atomberg"": 0, ""Atomberg Renesa"": 0, ""Atomberg Efficio"": 0, ""Atomberg Studio"": 0, ""Orient"": 0, ""Havells"": 0, ""Usha"": 0, ""Crompton"": 0, ""Luminous"": 0, ""Bajaj"": 0, ""Polycab"": 0, ""V-Guard"": 0, ""Anchor"": 0, ""Panasonic"": 0}",,0.9960236549377441,positive,,
google,smart fan,79,https://www.diodes.com/part/view/AM4961A,AM4961A: Single Phase 12V BLDC Smart Fan and Motor Driver ...,For system flexibility the motor speed can be controlled by either an external PWM signal or by a DC voltage or from a Thermistor network.,www.diodes.com,,,,,AM4961A: Single Phase 12V BLDC Smart Fan and Motor Driver ... For system flexibility the motor speed can be controlled by either an external PWM signal or by a DC voltage or from a Thermistor network.,AM4961A: Single Phase 12V BLDC Smart Fan and Motor Driver ... For system flexibility the motor speed can be controlled by either an external PWM signal or by a DC voltage or from a Thermistor network. AM4961A: Single Phase 12V BLDC Smart Fan and Motor Driver ... For system flexibility the motor speed can be controlled by either an external PWM signal or by a DC voltage or from a Thermistor network.,"{""Atomberg"": 0, ""Atomberg Renesa"": 0, ""Atomberg Efficio"": 0, ""Atomberg Studio"": 0, ""Orient"": 0, ""Havells"": 0, ""Usha"": 0, ""Crompton"": 0, ""Luminous"": 0, ""Bajaj"": 0, ""Polycab"": 0, ""V-Guard"": 0, ""Anchor"": 0, ""Panasonic"": 0}",,-0.9846504926681519,negative,,
google,smart fan,80,https://www.linkedin.com/posts/markgressjr_bret-mccormick-the-smart-fan-washes-down-activity-7354244202706137091-KmsO,Bret McCormick the smart fan washes down their Little Caesars ...,"Jul 24, 2025 ... Bret McCormick the smart fan washes down their Little Caesars Pizza WITH crab fries from Chickie's and Pete's.",www.linkedin.com,,,,,"Bret McCormick the smart fan washes down their Little Caesars ... Jul 24, 2025 ... Bret McCormick the smart fan washes down their Little Caesars Pizza WITH crab fries from Chickie's and Pete's.","Bret McCormick the smart fan washes down their Little Caesars ... Jul 24, 2025 ... Bret McCormick the smart fan washes down their Little Caesars Pizza WITH crab fries from Chickie's and Pete's. Bret McCormick the smart fan washes down their Little Caesars ... Jul 24, 2025 ... Bret McCormick the smart fan washes down their Little Caesars Pizza WITH crab fries from Chickie's and Pete's.","{""Atomberg"": 0, ""Atomberg Renesa"": 0, ""Atomberg Efficio"": 0, ""Atomberg Studio"": 0, ""Orient"": 0, ""Havells"": 0, ""Usha"": 0, ""Crompton"": 0, ""Luminous"": 0, ""Bajaj"": 0, ""Polycab"": 0, ""V-Guard"": 0, ""Anchor"": 0, ""Panasonic"": 0}",,-0.9961802959442139,negative,,
google,smart fan,81,https://www.linkedin.com/posts/alexanderostrovsky_introducing-the-pisces-smart-fan-inspired-activity-7316638910959230976-xwNu,"Introducing the Pisces Smart Fan, inspired by our captivating ...","Apr 11, 2025 ... Introducing the Pisces Smart Fan, inspired by our captivating Luminaire line. The diffuser is crafted with genuine Spanish Alabaster, ...",www.linkedin.com,,,,,"Introducing the Pisces Smart Fan, inspired by our captivating ... Apr 11, 2025 ... Introducing the Pisces Smart Fan, inspired by our captivating Luminaire line. The diffuser is crafted with genuine Spanish Alabaster, ...","Introducing the Pisces Smart Fan, inspired by our captivating ... Apr 11, 2025 ... Introducing the Pisces Smart Fan, inspired by our captivating Luminaire line. The diffuser is crafted with genuine Spanish Alabaster, ... Introducing the Pisces Smart Fan, inspired by our captivating ... Apr 11, 2025 ... Introducing the Pisces Smart Fan, inspired by our captivating Luminaire line. The diffuser is crafted with genuine Spanish Alabaster, ...","{""Atomberg"": 0, ""Atomberg Renesa"": 0, ""Atomberg Efficio"": 0, ""Atomberg Studio"": 0, ""Orient"": 0, ""Havells"": 0, ""Usha"": 0, ""Crompton"": 0, ""Luminous"": 0, ""Bajaj"": 0, ""Polycab"": 0, ""V-Guard"": 0, ""Anchor"": 0, ""Panasonic"": 0}",,0.999754011631012,positive,,
google,smart fan,82,https://www.lowes.com/pl/light-switches-dimmers/fan-controls/cync-smart-fan-switch/4294398475-1820025985159,Cync Smart Fan Switch Fan Controls at Lowes.com,Find Cync Smart Fan Switch fan controls at Lowe's today. Shop fan controls and a variety of electrical products online at Lowes.com.,www.lowes.com,,,,,Cync Smart Fan Switch Fan Controls at Lowes.com Find Cync Smart Fan Switch fan controls at Lowe's today. Shop fan controls and a variety of electrical products online at Lowes.com.,Cync Smart Fan Switch Fan Controls at Lowes.com Find Cync Smart Fan Switch fan controls at Lowe's today. Shop fan controls and a variety of electrical products online at Lowes.com. Cync Smart Fan Switch Fan Controls at Lowes.com Find Cync Smart Fan Switch fan controls at Lowe's today. Shop fan controls and a variety of electrical products online at Lowes.com.,"{""Atomberg"": 0, ""Atomberg Renesa"": 0, ""Atomberg Efficio"": 0, ""Atomberg Studio"": 0, ""Orient"": 0, ""Havells"": 0, ""Usha"": 0, ""Crompton"": 0, ""Luminous"": 0, ""Bajaj"": 0, ""Polycab"": 0, ""V-Guard"": 0, ""Anchor"": 0, ""Panasonic"": 0}",,-0.991231381893158,negative,,
google,smart fan,83,https://www.instagram.com/p/DLrodhWBUbU/,"With the choice between smart control or remote operation, and a ...","Jul 4, 2025 ... ... Smart SmartFan Fan Innofque Fique que Inno DESISN. innofique's ... Only 2 days left to grab the Acero 55 Smart Fan DIY black ABS at a great price!",www.instagram.com,,,,,"With the choice between smart control or remote operation, and a ... Jul 4, 2025 ... ... Smart SmartFan Fan Innofque Fique que Inno DESISN. innofique's ... Only 2 days left to grab the Acero 55 Smart Fan DIY black ABS at a great price!","With the choice between smart control or remote operation, and a ... Jul 4, 2025 ... ... Smart SmartFan Fan Innofque Fique que Inno DESISN. innofique's ... Only 2 days left to grab the Acero 55 Smart Fan DIY black ABS at a great price! With the choice between smart control or remote operation, and a ... Jul 4, 2025 ... ... Smart SmartFan Fan Innofque Fique que Inno DESISN. innofique's ... Only 2 days left to grab the Acero 55 Smart Fan DIY black ABS at a great price!","{""Atomberg"": 0, ""Atomberg Renesa"": 0, ""Atomberg Efficio"": 0, ""Atomberg Studio"": 0, ""Orient"": 0, ""Havells"": 0, ""Usha"": 0, ""Crompton"": 0, ""Luminous"": 0, ""Bajaj"": 0, ""Polycab"": 0, ""V-Guard"": 0, ""Anchor"": 0, ""Panasonic"": 0}",,-0.9661163091659546,negative,,
google,smart fan,84,https://www.youtube.com/shorts/XmEufIDrq3A,"Smart fan? #NasaLazadaYan! Aesthetic na, presko pa ...","Dec 1, 2021 ... Share your videos with friends, family, and the world.",www.youtube.com,,,,,"Smart fan? #NasaLazadaYan! Aesthetic na, presko pa ... Dec 1, 2021 ... Share your videos with friends, family, and the world.","Smart fan? #NasaLazadaYan! Aesthetic na, presko pa ... Dec 1, 2021 ... Share your videos with friends, family, and the world. Smart fan? #NasaLazadaYan! Aesthetic na, presko pa ... Dec 1, 2021 ... Share your videos with friends, family, and the world.","{""Atomberg"": 0, ""Atomberg Renesa"": 0, ""Atomberg Efficio"": 0, ""Atomberg Studio"": 0, ""Orient"": 0, ""Havells"": 0, ""Usha"": 0, ""Crompton"": 0, ""Luminous"": 0, ""Bajaj"": 0, ""Polycab"": 0, ""V-Guard"": 0, ""Anchor"": 0, ""Panasonic"": 0}",,0.9980130195617676,positive,,
