platform,query,rank,url,title,snippet,publisher,views,likes,comments,published_at,raw_text,scan_text,brand_mentions_json,dominant_brand,sentiment,sentiment_label,engagement,wsov_item
google,smart fan,1,https://www.amazon.com/smart-fans/s?k=smart+fans,Smart Fans - Amazon.com,"Smart Oscillating Quiet Floor Fans, Standing Bladeless Fan with Remote and WiFi Voice Control, 4 Modes, 4 Speeds, 8H Timer, 28dB, Works with Alexa/Google",www.amazon.com,,,,,"Smart Fans - Amazon.com Smart Oscillating Quiet Floor Fans, Standing Bladeless Fan with Remote and WiFi Voice Control, 4 Modes, 4 Speeds, 8H Timer, 28dB, Works with Alexa/Google","Smart Fans - Amazon.com Smart Oscillating Quiet Floor Fans, Standing Bladeless Fan with Remote and WiFi Voice Control, 4 Modes, 4 Speeds, 8H Timer, 28dB, Works with Alexa/Google Smart Fans - Amazon.com Smart Oscillating Quiet Floor Fans, Standing Bladeless Fan with Remote and WiFi Voice Control, 4 Modes, 4 Speeds, 8H Timer, 28dB, Works with Alexa/Google","{""Atomberg"": 0, ""Atomberg Renesa"": 0, ""Atomberg Efficio"": 0, ""Atomberg Studio"": 0, ""Orient"": 0, ""Havells"": 0, ""Usha"": 0, ""Crompton"": 0, ""Luminous"": 0, ""Bajaj"": 0, ""Polycab"": 0, ""V-Guard"": 0, ""Anchor"": 0, ""Panasonic"": 0}",,-0.8314087986946106,negative,,
google,smart fan,2,https://www.reddit.com/r/homeautomation/comments/oyk06t/smart_fan_recommendations/,Smart Fan Recommendations : r/homeautomation,"Aug 5, 2021 ... I recently got the 52"" modern forms smart fan with light from Amazon. I control the fan and the lights through my Google smart devices, so far ...",www.reddit.com,,,,,"Smart Fan Recommendations : r/homeautomation Aug 5, 2021 ... I recently got the 52"" modern forms smart fan with light from Amazon. I control the fan and the lights through my Google smart devices, so far ...","Smart Fan Recommendations : r/homeautomation Aug 5, 2021 ... I recently got the 52"" modern forms smart fan with light from Amazon. I control the fan and the lights through my Google smart devices, so far ... Smart Fan Recommendations : r/homeautomation Aug 5, 2021 ... I recently got the 52"" modern forms smart fan with light from Amazon. I control the fan and the lights through my Google smart devices, so far ...","{""Atomberg"": 0, ""Atomberg Renesa"": 0, ""Atomberg Efficio"": 0, ""Atomberg Studio"": 0, ""Orient"": 0, ""Havells"": 0, ""Usha"": 0, ""Crompton"": 0, ""Luminous"": 0, ""Bajaj"": 0, ""Polycab"": 0, ""V-Guard"": 0, ""Anchor"": 0, ""Panasonic"": 0}",,-0.6117483377456665,negative,,
google,smart fan,3,https://www.casetawireless.com/us/en/products/dimmers-switches/original-smart-fan-speed-control-switch,Original Smart Fan Speed Control Switch | Caséta by Lutron,"Provides control of your ceiling fan right from the wall, choose from 4 fan speeds plus off, for increased comfort.",www.casetawireless.com,,,,,"Original Smart Fan Speed Control Switch | Caséta by Lutron Provides control of your ceiling fan right from the wall, choose from 4 fan speeds plus off, for increased comfort.","Original Smart Fan Speed Control Switch | Caséta by Lutron Provides control of your ceiling fan right from the wall, choose from 4 fan speeds plus off, for increased comfort. Original Smart Fan Speed Control Switch | Caséta by Lutron Provides control of your ceiling fan right from the wall, choose from 4 fan speeds plus off, for increased comfort.","{""Atomberg"": 0, ""Atomberg Renesa"": 0, ""Atomberg Efficio"": 0, ""Atomberg Studio"": 0, ""Orient"": 0, ""Havells"": 0, ""Usha"": 0, ""Crompton"": 0, ""Luminous"": 0, ""Bajaj"": 0, ""Polycab"": 0, ""V-Guard"": 0, ""Anchor"": 0, ""Panasonic"": 0}",,0.6477335691452026,positive,,
google,smart fan,4,https://www.pasco.com/products/lab-apparatus/mechanics/dynamics-accessories/smart-fan-accessory,Smart Fan Accessory - ME-1242 - Products | PASCO,Plugging it into a Smart Cart gives this Smart Fan Accessory added capabilities: Hands-off Operation: You can turn the Smart Fan on and off wirelessly from ...,www.pasco.com,,,,,Smart Fan Accessory - ME-1242 - Products | PASCO Plugging it into a Smart Cart gives this Smart Fan Accessory added capabilities: Hands-off Operation: You can turn the Smart Fan on and off wirelessly from ...,Smart Fan Accessory - ME-1242 - Products | PASCO Plugging it into a Smart Cart gives this Smart Fan Accessory added capabilities: Hands-off Operation: You can turn the Smart Fan on and off wirelessly from ... Smart Fan Accessory - ME-1242 - Products | PASCO Plugging it into a Smart Cart gives this Smart Fan Accessory added capabilities: Hands-off Operation: You can turn the Smart Fan on and off wirelessly from ...,"{""Atomberg"": 0, ""Atomberg Renesa"": 0, ""Atomberg Efficio"": 0, ""Atomberg Studio"": 0, ""Orient"": 0, ""Havells"": 0, ""Usha"": 0, ""Crompton"": 0, ""Luminous"": 0, ""Bajaj"": 0, ""Polycab"": 0, ""V-Guard"": 0, ""Anchor"": 0, ""Panasonic"": 0}",,0.8637911677360535,positive,,
google,smart fan,5,https://www.hinkley.com/900752fgt-lwd.html,"Hover 52"" LED Smart Fan","Hover is a stunning modern upgrade for any project. Available in Brushed Nickel, Graphite, Matte White or Matte Black, Hover comes equipped with integrated LED ...",www.hinkley.com,,,,,"Hover 52"" LED Smart Fan Hover is a stunning modern upgrade for any project. Available in Brushed Nickel, Graphite, Matte White or Matte Black, Hover comes equipped with integrated LED ...","Hover 52"" LED Smart Fan Hover is a stunning modern upgrade for any project. Available in Brushed Nickel, Graphite, Matte White or Matte Black, Hover comes equipped with integrated LED ... Hover 52"" LED Smart Fan Hover is a stunning modern upgrade for any project. Available in Brushed Nickel, Graphite, Matte White or Matte Black, Hover comes equipped with integrated LED ...","{""Atomberg"": 0, ""Atomberg Renesa"": 0, ""Atomberg Efficio"": 0, ""Atomberg Studio"": 0, ""Orient"": 0, ""Havells"": 0, ""Usha"": 0, ""Crompton"": 0, ""Luminous"": 0, ""Bajaj"": 0, ""Polycab"": 0, ""V-Guard"": 0, ""Anchor"": 0, ""Panasonic"": 0}",,0.9983250498771667,positive,,
google,smart fan,6,https://www.cycplus.com/products/cycplus-high-power-smart-fitness-fan,CYCPLUS High-Power Smart Fitness Fan,"Wind speed up to 50KM/H | Automatic control via heart rate, speed, and power data | Handlebar-mounted remote included| Noise less than 45dB | Two base ...",www.cycplus.com,,,,,"CYCPLUS High-Power Smart Fitness Fan Wind speed up to 50KM/H | Automatic control via heart rate, speed, and power data | Handlebar-mounted remote included| Noise less than 45dB | Two base ...","CYCPLUS High-Power Smart Fitness Fan Wind speed up to 50KM/H | Automatic control via heart rate, speed, and power data | Handlebar-mounted remote included| Noise less than 45dB | Two base ... CYCPLUS High-Power Smart Fitness Fan Wind speed up to 50KM/H | Automatic control via heart rate, speed, and power data | Handlebar-mounted remote included| Noise less than 45dB | Two base ...","{""Atomberg"": 0, ""Atomberg Renesa"": 0, ""Atomberg Efficio"": 0, ""Atomberg Studio"": 0, ""Orient"": 0, ""Havells"": 0, ""Usha"": 0, ""Crompton"": 0, ""Luminous"": 0, ""Bajaj"": 0, ""Polycab"": 0, ""V-Guard"": 0, ""Anchor"": 0, ""Panasonic"": 0}",,-0.9888870120048523,negative,,
google,smart fan,7,https://www.hinkley.com/906660fbd-nwd.html,"Liv 60"" Smart Fan",Liv is equipped with a 6-speed DC motor that is WiFi enabled and ready to connect right out of the box. Operated by the HIRO control or WiFi compatible with the ...,www.hinkley.com,,,,,"Liv 60"" Smart Fan Liv is equipped with a 6-speed DC motor that is WiFi enabled and ready to connect right out of the box. Operated by the HIRO control or WiFi compatible with the ...","Liv 60"" Smart Fan Liv is equipped with a 6-speed DC motor that is WiFi enabled and ready to connect right out of the box. Operated by the HIRO control or WiFi compatible with the ... Liv 60"" Smart Fan Liv is equipped with a 6-speed DC motor that is WiFi enabled and ready to connect right out of the box. Operated by the HIRO control or WiFi compatible with the ...","{""Atomberg"": 0, ""Atomberg Renesa"": 0, ""Atomberg Efficio"": 0, ""Atomberg Studio"": 0, ""Orient"": 0, ""Havells"": 0, ""Usha"": 0, ""Crompton"": 0, ""Luminous"": 0, ""Bajaj"": 0, ""Polycab"": 0, ""V-Guard"": 0, ""Anchor"": 0, ""Panasonic"": 0}",,-0.8319033980369568,negative,,
google,smart fan,8,https://www.wahoofitness.com/devices/indoor-cycling/accessories/kickr-headwind-buy-us,KICKR Headwind Smart Bluetooth Fan | Wahoo Fitness,"The KICKR HEADWIND smart Bluetooth fan intelligently controls fan speeds, producing outdoor worthy headwinds to provide optimized indoor bike training ...",www.wahoofitness.com,,,,,"KICKR Headwind Smart Bluetooth Fan | Wahoo Fitness The KICKR HEADWIND smart Bluetooth fan intelligently controls fan speeds, producing outdoor worthy headwinds to provide optimized indoor bike training ...","KICKR Headwind Smart Bluetooth Fan | Wahoo Fitness The KICKR HEADWIND smart Bluetooth fan intelligently controls fan speeds, producing outdoor worthy headwinds to provide optimized indoor bike training ... KICKR Headwind Smart Bluetooth Fan | Wahoo Fitness The KICKR HEADWIND smart Bluetooth fan intelligently controls fan speeds, producing outdoor worthy headwinds to provide optimized indoor bike training ...","{""Atomberg"": 0, ""Atomberg Renesa"": 0, ""Atomberg Efficio"": 0, ""Atomberg Studio"": 0, ""Orient"": 0, ""Havells"": 0, ""Usha"": 0, ""Crompton"": 0, ""Luminous"": 0, ""Bajaj"": 0, ""Polycab"": 0, ""V-Guard"": 0, ""Anchor"": 0, ""Panasonic"": 0}",,0.9949617385864258,positive,,
google,smart fan,9,https://us.govee.com/collections/smart-fan,Smart Fan | Govee US,Upgrade your cooling experience with our innovative smart fans. Control your comfort from anywhere with intuitive app integration and voice commands.,us.govee.com,,,,,Smart Fan | Govee US Upgrade your cooling experience with our innovative smart fans. Control your comfort from anywhere with intuitive app integration and voice commands.,Smart Fan | Govee US Upgrade your cooling experience with our innovative smart fans. Control your comfort from anywhere with intuitive app integration and voice commands. Smart Fan | Govee US Upgrade your cooling experience with our innovative smart fans. Control your comfort from anywhere with intuitive app integration and voice commands.,"{""Atomberg"": 0, ""Atomberg Renesa"": 0, ""Atomberg Efficio"": 0, ""Atomberg Studio"": 0, ""Orient"": 0, ""Havells"": 0, ""Usha"": 0, ""Crompton"": 0, ""Luminous"": 0, ""Bajaj"": 0, ""Polycab"": 0, ""V-Guard"": 0, ""Anchor"": 0, ""Panasonic"": 0}",,0.9893303513526917,positive,,
google,smart fan,10,https://inovelli.com/products/blue-series-fan-switch-zigbee-3-0,Blue Series (Zigbee) - Smart Fan Switch – Inovelli,"Experience the future of lighting. Animated Notifications, Multi-Tap Scene Control, Smart Fan Mode And Over 75 Configurable Parameters.",inovelli.com,,,,,"Blue Series (Zigbee) - Smart Fan Switch – Inovelli Experience the future of lighting. Animated Notifications, Multi-Tap Scene Control, Smart Fan Mode And Over 75 Configurable Parameters.","Blue Series (Zigbee) - Smart Fan Switch – Inovelli Experience the future of lighting. Animated Notifications, Multi-Tap Scene Control, Smart Fan Mode And Over 75 Configurable Parameters. Blue Series (Zigbee) - Smart Fan Switch – Inovelli Experience the future of lighting. Animated Notifications, Multi-Tap Scene Control, Smart Fan Mode And Over 75 Configurable Parameters.","{""Atomberg"": 0, ""Atomberg Renesa"": 0, ""Atomberg Efficio"": 0, ""Atomberg Studio"": 0, ""Orient"": 0, ""Havells"": 0, ""Usha"": 0, ""Crompton"": 0, ""Luminous"": 0, ""Bajaj"": 0, ""Polycab"": 0, ""V-Guard"": 0, ""Anchor"": 0, ""Panasonic"": 0}",,0.9727933406829834,positive,,
google,smart fan,11,https://www.homedepot.com/b/Smart-Home-Smart-Ceiling-Fans/N-5yc1vZccuu,Smart Ceiling Fans at The Home Depot,Smart Indoor/Outdoor Matte Black Ceiling Fan with Remote Included Powered by Hubspace. Experience unparalleled air circulation and smart home convenience with ...,www.homedepot.com,,,,,Smart Ceiling Fans at The Home Depot Smart Indoor/Outdoor Matte Black Ceiling Fan with Remote Included Powered by Hubspace. Experience unparalleled air circulation and smart home convenience with ...,Smart Ceiling Fans at The Home Depot Smart Indoor/Outdoor Matte Black Ceiling Fan with Remote Included Powered by Hubspace. Experience unparalleled air circulation and smart home convenience with ... Smart Ceiling Fans at The Home Depot Smart Indoor/Outdoor Matte Black Ceiling Fan with Remote Included Powered by Hubspace. Experience unparalleled air circulation and smart home convenience with ...,"{""Atomberg"": 0, ""Atomberg Renesa"": 0, ""Atomberg Efficio"": 0, ""Atomberg Studio"": 0, ""Orient"": 0, ""Havells"": 0, ""Usha"": 0, ""Crompton"": 0, ""Luminous"": 0, ""Bajaj"": 0, ""Polycab"": 0, ""V-Guard"": 0, ""Anchor"": 0, ""Panasonic"": 0}",,0.9377987384796143,positive,,
google,smart fan,12,https://smafan.com/,CARRO Smart Ceiling Fan and lighting Outlet-Smafan,Smafan Ranger smart ceiling fan with energy-efficient LED light kit has 3000 lumens and. Ranger 52 inch Low Profile Smart Ceiling Fan ...,smafan.com,,,,,CARRO Smart Ceiling Fan and lighting Outlet-Smafan Smafan Ranger smart ceiling fan with energy-efficient LED light kit has 3000 lumens and. Ranger 52 inch Low Profile Smart Ceiling Fan ...,CARRO Smart Ceiling Fan and lighting Outlet-Smafan Smafan Ranger smart ceiling fan with energy-efficient LED light kit has 3000 lumens and. Ranger 52 inch Low Profile Smart Ceiling Fan ... CARRO Smart Ceiling Fan and lighting Outlet-Smafan Smafan Ranger smart ceiling fan with energy-efficient LED light kit has 3000 lumens and. Ranger 52 inch Low Profile Smart Ceiling Fan ...,"{""Atomberg"": 0, ""Atomberg Renesa"": 0, ""Atomberg Efficio"": 0, ""Atomberg Studio"": 0, ""Orient"": 0, ""Havells"": 0, ""Usha"": 0, ""Crompton"": 0, ""Luminous"": 0, ""Bajaj"": 0, ""Polycab"": 0, ""V-Guard"": 0, ""Anchor"": 0, ""Panasonic"": 0}",,0.9331153631210327,positive,,
google,smart fan,13,https://sequentmicrosystems.com/products/smart-fan-hat-for-raspberry-pi,Smart Fan HAT the Best Cooling Solution for Raspberry Pi Zero to 5 ...,"Smart Fan HAT for Raspberry Pi zero to 5; PWM controlled fan with 6cfm airflow; Two layer stackable; Super quiet and efficient, keeps the Pi at constant ...",sequentmicrosystems.com,,,,,"Smart Fan HAT the Best Cooling Solution for Raspberry Pi Zero to 5 ... Smart Fan HAT for Raspberry Pi zero to 5; PWM controlled fan with 6cfm airflow; Two layer stackable; Super quiet and efficient, keeps the Pi at constant ...","Smart Fan HAT the Best Cooling Solution for Raspberry Pi Zero to 5 ... Smart Fan HAT for Raspberry Pi zero to 5; PWM controlled fan with 6cfm airflow; Two layer stackable; Super quiet and efficient, keeps the Pi at constant ... Smart Fan HAT the Best Cooling Solution for Raspberry Pi Zero to 5 ... Smart Fan HAT for Raspberry Pi zero to 5; PWM controlled fan with 6cfm airflow; Two layer stackable; Super quiet and efficient, keeps the Pi at constant ...","{""Atomberg"": 0, ""Atomberg Renesa"": 0, ""Atomberg Efficio"": 0, ""Atomberg Studio"": 0, ""Orient"": 0, ""Havells"": 0, ""Usha"": 0, ""Crompton"": 0, ""Luminous"": 0, ""Bajaj"": 0, ""Polycab"": 0, ""V-Guard"": 0, ""Anchor"": 0, ""Panasonic"": 0}",,0.9973425269126892,positive,,
google,smart fan,14,https://store.leviton.com/products/decora-smart-wi-fi-2nd-gen-fan-speed-controller-single-pole-or-3-way-d24sf-1bw,"D24SF Decora Smart Fan Speed Controller, Wi-Fi 2nd Gen ...","Decora Smart Fan Speed Controller, single pole, 3-way, or multi-location when used with Wired Switch or Dimmer Companions or Wire-Free Anywhere Dimmer or ...",store.leviton.com,,,,,"D24SF Decora Smart Fan Speed Controller, Wi-Fi 2nd Gen ... Decora Smart Fan Speed Controller, single pole, 3-way, or multi-location when used with Wired Switch or Dimmer Companions or Wire-Free Anywhere Dimmer or ...","D24SF Decora Smart Fan Speed Controller, Wi-Fi 2nd Gen ... Decora Smart Fan Speed Controller, single pole, 3-way, or multi-location when used with Wired Switch or Dimmer Companions or Wire-Free Anywhere Dimmer or ... D24SF Decora Smart Fan Speed Controller, Wi-Fi 2nd Gen ... Decora Smart Fan Speed Controller, single pole, 3-way, or multi-location when used with Wired Switch or Dimmer Companions or Wire-Free Anywhere Dimmer or ...","{""Atomberg"": 0, ""Atomberg Renesa"": 0, ""Atomberg Efficio"": 0, ""Atomberg Studio"": 0, ""Orient"": 0, ""Havells"": 0, ""Usha"": 0, ""Crompton"": 0, ""Luminous"": 0, ""Bajaj"": 0, ""Polycab"": 0, ""V-Guard"": 0, ""Anchor"": 0, ""Panasonic"": 0}",,-0.9913879036903381,negative,,
google,smart fan,15,https://community.smartthings.com/t/ge-smart-fan-control-with-smart-bulbs-fan-off-with-lights-on/202511,GE Smart Fan Control with Smart Bulbs - Fan off with lights on ...,"Aug 17, 2020 ... SIMPLE FAN CONTROL – Operate, schedule and create custom scenes for your ceiling fan wirelessly with a smartphone or voice commands when ...",community.smartthings.com,,,,,"GE Smart Fan Control with Smart Bulbs - Fan off with lights on ... Aug 17, 2020 ... SIMPLE FAN CONTROL – Operate, schedule and create custom scenes for your ceiling fan wirelessly with a smartphone or voice commands when ...","GE Smart Fan Control with Smart Bulbs - Fan off with lights on ... Aug 17, 2020 ... SIMPLE FAN CONTROL – Operate, schedule and create custom scenes for your ceiling fan wirelessly with a smartphone or voice commands when ... GE Smart Fan Control with Smart Bulbs - Fan off with lights on ... Aug 17, 2020 ... SIMPLE FAN CONTROL – Operate, schedule and create custom scenes for your ceiling fan wirelessly with a smartphone or voice commands when ...","{""Atomberg"": 0, ""Atomberg Renesa"": 0, ""Atomberg Efficio"": 0, ""Atomberg Studio"": 0, ""Orient"": 0, ""Havells"": 0, ""Usha"": 0, ""Crompton"": 0, ""Luminous"": 0, ""Bajaj"": 0, ""Polycab"": 0, ""V-Guard"": 0, ""Anchor"": 0, ""Panasonic"": 0}",,-0.9840694069862366,negative,,
google,smart fan,16,https://community.inovelli.com/t/few-questions-about-new-setup-with-blue-series-smart-fan-light-canopy-module-dimmer-switch/18675,Few questions about new setup with Blue Series Smart Fan/Light ...,"Feb 3, 2025 ... The solution would be to use a canopy module which allows for independent control of the fan motor and the lights.",community.inovelli.com,,,,,"Few questions about new setup with Blue Series Smart Fan/Light ... Feb 3, 2025 ... The solution would be to use a canopy module which allows for independent control of the fan motor and the lights.","Few questions about new setup with Blue Series Smart Fan/Light ... Feb 3, 2025 ... The solution would be to use a canopy module which allows for independent control of the fan motor and the lights. Few questions about new setup with Blue Series Smart Fan/Light ... Feb 3, 2025 ... The solution would be to use a canopy module which allows for independent control of the fan motor and the lights.","{""Atomberg"": 0, ""Atomberg Renesa"": 0, ""Atomberg Efficio"": 0, ""Atomberg Studio"": 0, ""Orient"": 0, ""Havells"": 0, ""Usha"": 0, ""Crompton"": 0, ""Luminous"": 0, ""Bajaj"": 0, ""Polycab"": 0, ""V-Guard"": 0, ""Anchor"": 0, ""Panasonic"": 0}",,-0.988835871219635,negative,,
google,smart fan,17,https://modernforms.com/product/aviator/,Aviator 54 – Modern Forms,"Inspired by the golden age of flying, this smart fan takes technology to the next level. Pair it with the Bluetooth remote control or use the Modern Forms app ...",modernforms.com,,,,,"Aviator 54 – Modern Forms Inspired by the golden age of flying, this smart fan takes technology to the next level. Pair it with the Bluetooth remote control or use the Modern Forms app ...","Aviator 54 – Modern Forms Inspired by the golden age of flying, this smart fan takes technology to the next level. Pair it with the Bluetooth remote control or use the Modern Forms app ... Aviator 54 – Modern Forms Inspired by the golden age of flying, this smart fan takes technology to the next level. Pair it with the Bluetooth remote control or use the Modern Forms app ...","{""Atomberg"": 0, ""Atomberg Renesa"": 0, ""Atomberg Efficio"": 0, ""Atomberg Studio"": 0, ""Orient"": 0, ""Havells"": 0, ""Usha"": 0, ""Crompton"": 0, ""Luminous"": 0, ""Bajaj"": 0, ""Polycab"": 0, ""V-Guard"": 0, ""Anchor"": 0, ""Panasonic"": 0}",,0.9614360332489014,positive,,
google,smart fan,18,https://shop.meross.com/products/meross-wi-fi-smart-fan-control-mfc100hk,"Meross Wi-Fi Smart Fan and Light Wall Switch, MFC100HK (US/CA ...","Remote and Voice Control: Seamlessly operate your ceiling fan and lights remotely through Meross app or use voice commands with Amazon Alexa, Google Assistant, ...",shop.meross.com,,,,,"Meross Wi-Fi Smart Fan and Light Wall Switch, MFC100HK (US/CA ... Remote and Voice Control: Seamlessly operate your ceiling fan and lights remotely through Meross app or use voice commands with Amazon Alexa, Google Assistant, ...","Meross Wi-Fi Smart Fan and Light Wall Switch, MFC100HK (US/CA ... Remote and Voice Control: Seamlessly operate your ceiling fan and lights remotely through Meross app or use voice commands with Amazon Alexa, Google Assistant, ... Meross Wi-Fi Smart Fan and Light Wall Switch, MFC100HK (US/CA ... Remote and Voice Control: Seamlessly operate your ceiling fan and lights remotely through Meross app or use voice commands with Amazon Alexa, Google Assistant, ...","{""Atomberg"": 0, ""Atomberg Renesa"": 0, ""Atomberg Efficio"": 0, ""Atomberg Studio"": 0, ""Orient"": 0, ""Havells"": 0, ""Usha"": 0, ""Crompton"": 0, ""Luminous"": 0, ""Bajaj"": 0, ""Polycab"": 0, ""V-Guard"": 0, ""Anchor"": 0, ""Panasonic"": 0}",,-0.9743798971176147,negative,,
google,smart fan,19,https://controlresources.com/ac-fan-control-ac-motor-control-smartfan-nimbus/,SmartFan® Nimbus Single-phase AC motor speed control,"SmartFan Nimbus AC motor speed control is designed to control AC motors, pumps, and fans in HVAC, electronics, and industrial control applications.",controlresources.com,,,,,"SmartFan® Nimbus Single-phase AC motor speed control SmartFan Nimbus AC motor speed control is designed to control AC motors, pumps, and fans in HVAC, electronics, and industrial control applications.","SmartFan® Nimbus Single-phase AC motor speed control SmartFan Nimbus AC motor speed control is designed to control AC motors, pumps, and fans in HVAC, electronics, and industrial control applications. SmartFan® Nimbus Single-phase AC motor speed control SmartFan Nimbus AC motor speed control is designed to control AC motors, pumps, and fans in HVAC, electronics, and industrial control applications.","{""Atomberg"": 0, ""Atomberg Renesa"": 0, ""Atomberg Efficio"": 0, ""Atomberg Studio"": 0, ""Orient"": 0, ""Havells"": 0, ""Usha"": 0, ""Crompton"": 0, ""Luminous"": 0, ""Bajaj"": 0, ""Polycab"": 0, ""V-Guard"": 0, ""Anchor"": 0, ""Panasonic"": 0}",,-0.9853315353393555,negative,,
google,smart fan,20,https://atomismart.com/products/nouvo3-smart-ceiling-fan,"Nouvo³ Smart Flush Mount Fan | 52"" LED Indoor Fan – Atomi Smart","Smart and stylish, this 52” Smart Ceiling Fan cools and circulates the air in indoor areas up to 400ft². Built-in LEDs and a 6-speed, whisper-quiet reversible ...",atomismart.com,,,,,"Nouvo³ Smart Flush Mount Fan | 52"" LED Indoor Fan – Atomi Smart Smart and stylish, this 52” Smart Ceiling Fan cools and circulates the air in indoor areas up to 400ft². Built-in LEDs and a 6-speed, whisper-quiet reversible ...","Nouvo³ Smart Flush Mount Fan | 52"" LED Indoor Fan – Atomi Smart Smart and stylish, this 52” Smart Ceiling Fan cools and circulates the air in indoor areas up to 400ft². Built-in LEDs and a 6-speed, whisper-quiet reversible ... Nouvo³ Smart Flush Mount Fan | 52"" LED Indoor Fan – Atomi Smart Smart and stylish, this 52” Smart Ceiling Fan cools and circulates the air in indoor areas up to 400ft². Built-in LEDs and a 6-speed, whisper-quiet reversible ...","{""Atomberg"": 0, ""Atomberg Renesa"": 0, ""Atomberg Efficio"": 0, ""Atomberg Studio"": 0, ""Orient"": 0, ""Havells"": 0, ""Usha"": 0, ""Crompton"": 0, ""Luminous"": 0, ""Bajaj"": 0, ""Polycab"": 0, ""V-Guard"": 0, ""Anchor"": 0, ""Panasonic"": 0}",,0.9904643297195435,positive,,
google,smart fan,22,https://us.zwift.com/products/wahoo-kickr-headwind,Wahoo Headwind Smart Fan | Ultimate Zwift Setup | Accessories,"This smart fan is your ticket to optimal airflow. Designed to automatically keep you cool, by adapting its speed based on your intensity.",us.zwift.com,,,,,"Wahoo Headwind Smart Fan | Ultimate Zwift Setup | Accessories This smart fan is your ticket to optimal airflow. Designed to automatically keep you cool, by adapting its speed based on your intensity.","Wahoo Headwind Smart Fan | Ultimate Zwift Setup | Accessories This smart fan is your ticket to optimal airflow. Designed to automatically keep you cool, by adapting its speed based on your intensity. Wahoo Headwind Smart Fan | Ultimate Zwift Setup | Accessories This smart fan is your ticket to optimal airflow. Designed to automatically keep you cool, by adapting its speed based on your intensity.","{""Atomberg"": 0, ""Atomberg Renesa"": 0, ""Atomberg Efficio"": 0, ""Atomberg Studio"": 0, ""Orient"": 0, ""Havells"": 0, ""Usha"": 0, ""Crompton"": 0, ""Luminous"": 0, ""Bajaj"": 0, ""Polycab"": 0, ""V-Guard"": 0, ""Anchor"": 0, ""Panasonic"": 0}",,0.995402455329895,positive,,
